,index,Unnamed: 0,congress,latestAction,number,originChamber,originChamberCode,title,type,updateDate,updateDateIncludingText,url
714,181787,74,116,"{'actionDate': '2020-12-31', 'text': 'Became Public Law No: 116-279.'}",2683,Senate,S,Child Care Protection Improvement Act of 2020,S,2022-11-01,2022-11-01T04:17:45Z,https://api.congress.gov/v3/bill/116/s/2683?format=json
715,181788,75,116,"{'actionDate': '2020-12-31', 'text': 'Became Public Law No: 116-278.'}",2216,Senate,S,TEAM Veteran Caregivers Act,S,2022-11-01,2022-11-01T13:50:29Z,https://api.congress.gov/v3/bill/116/s/2216?format=json
716,181789,76,116,"{'actionDate': '2020-12-31', 'text': 'Became Public Law No: 116-277.'}",2174,Senate,S,Missing Persons and Unidentified Remains Act of 2019,S,2022-11-01,2022-11-01T13:50:32Z,https://api.congress.gov/v3/bill/116/s/2174?format=json
717,181790,77,116,"{'actionDate': '2020-12-31', 'text': 'Became Public Law No: 116-276.'}",1869,Senate,S,Secure Federal LEASEs Act,S,2022-11-01,2022-11-01T13:50:05Z,https://api.congress.gov/v3/bill/116/s/1869?format=json
718,181791,78,116,"{'actionDate': '2020-12-31', 'text': 'Became Public Law No: 116-275.'}",1694,Senate,S,One Small Step to Protect Human Heritage in Space Act,S,2022-11-01,2022-11-01T13:50:33Z,https://api.congress.gov/v3/bill/116/s/1694?format=json
719,181792,79,116,"{'actionDate': '2020-12-31', 'text': 'Became Public Law No: 116-274.'}",1342,Senate,S,Great Lakes Environmental Sensitivity Index Act of 2020,S,2022-10-28,2022-10-28T01:46:01Z,https://api.congress.gov/v3/bill/116/s/1342?format=json
720,181793,80,116,"{'actionDate': '2020-12-31', 'text': 'Became Public Law No: 116-273.'}",1130,Senate,S,Scarlett's Sunshine on Sudden Unexpected Death Act,S,2022-11-05,2022-11-05T19:25:09Z,https://api.congress.gov/v3/bill/116/s/1130?format=json
721,181809,96,116,"{'actionDate': '2020-12-30', 'text': 'Became Public Law No: 116-262.'}",900,Senate,S,"A bill to designate the community-based outpatient clinic of the Department of Veterans Affairs in Bozeman, Montana, as the ""Travis W. Atkins Department of Veterans Affairs Clinic"".",S,2022-11-05,2022-11-05T19:30:02Z,https://api.congress.gov/v3/bill/116/s/900?format=json
722,181810,97,116,"{'actionDate': '2020-12-30', 'text': 'Became Public Law No: 116-269.'}",5036,Senate,S,Secret Service Overtime Pay Extension Act,S,2022-08-10,2022-08-10T23:38:57Z,https://api.congress.gov/v3/bill/116/s/5036?format=json
723,181811,98,116,"{'actionDate': '2020-12-30', 'text': 'Became Public Law No: 116-268.'}",4684,Senate,S,"A bill to designate the facility of the United States Postal Service located at 440 Arapahoe Street in Thermopolis, Wyoming, as the ""Robert L. Brown Post Office"".",S,2022-08-10,2022-08-10T23:38:57Z,https://api.congress.gov/v3/bill/116/s/4684?format=json
724,181812,99,116,"{'actionDate': '2020-12-30', 'text': 'Became Public Law No: 116-267.'}",4126,Senate,S,"A bill to designate the facility of the United States Postal Service located at 104 East Main Street in Port Washington, Wisconsin, as the ""Joseph G. Demler Post Office"".",S,2022-08-10,2022-08-10T23:38:57Z,https://api.congress.gov/v3/bill/116/s/4126?format=json
725,181813,100,116,"{'actionDate': '2020-12-30', 'text': 'Became Public Law No: 116-266.'}",3462,Senate,S,"A bill to designate the facility of the United States Postal Service located at 909 West Holiday Drive in Fate, Texas, as the ""Ralph Hall Post Office"".",S,2022-08-10,2022-08-10T23:38:57Z,https://api.congress.gov/v3/bill/116/s/3462?format=json
726,181814,101,116,"{'actionDate': '2020-12-30', 'text': 'Became Public Law No: 116-265.'}",3461,Senate,S,"A bill to designate the facility of the United States Postal Service located at 2600 Wesley Street in Greenville, Texas, as the ""Audie Murphy Post Office Building"".",S,2022-08-10,2022-08-10T23:38:57Z,https://api.congress.gov/v3/bill/116/s/3461?format=json
727,181815,102,116,"{'actionDate': '2020-12-30', 'text': 'Became Public Law No: 116-264.'}",3257,Senate,S,"A bill to designate the facility of the United States Postal Service located at 311 West Wisconsin Avenue in Tomahawk, Wisconsin, as the ""Einar 'Sarge' H. Ingman, Jr. Post Office Building"".",S,2022-08-10,2022-08-10T23:38:57Z,https://api.congress.gov/v3/bill/116/s/3257?format=json
728,181816,103,116,"{'actionDate': '2020-12-30', 'text': 'Became Public Law No: 116-263.'}",2472,Senate,S,Neil A. Armstrong Test Facility Act,S,2022-11-01,2022-11-01T13:50:03Z,https://api.congress.gov/v3/bill/116/s/2472?format=json
729,181817,104,116,"{'actionDate': '2020-12-30', 'text': 'Became Public Law No: 116-261.'}",212,Senate,S,Indian Community Economic Enhancement Act of 2020,S,2022-11-05,2022-11-05T19:27:03Z,https://api.congress.gov/v3/bill/116/s/212?format=json
730,181828,115,116,"{'actionDate': '2020-12-27', 'text': 'Became Public Law No: 116-260.'}",133,House,H,"Consolidated Appropriations Act, 2021",HR,2022-11-01,2022-11-01T13:49:19Z,https://api.congress.gov/v3/bill/116/hr/133?format=json
731,181849,136,116,"{'actionDate': '2020-12-23', 'text': 'Became Public Law No: 116-254.'}",4761,House,H,DHS Opioid Detection Resilience Act of 2019,HR,2022-11-01,2022-11-01T03:47:34Z,https://api.congress.gov/v3/bill/116/hr/4761?format=json
732,181850,137,116,"{'actionDate': '2020-12-23', 'text': 'Became Public Law No: 116-253.'}",3465,House,H,Fallen Journalists Memorial Act,HR,2022-11-01,2022-11-01T13:50:54Z,https://api.congress.gov/v3/bill/116/hr/3465?format=json
733,181851,138,116,"{'actionDate': '2020-12-23', 'text': 'Became Public Law No: 116-259.'}",2981,Senate,S,National Oceanic and Atmospheric Administration Commissioned Officer Corps Amendments Act of 2020,S,2022-10-28,2022-10-28T01:46:07Z,https://api.congress.gov/v3/bill/116/s/2981?format=json
734,181852,139,116,"{'actionDate': '2020-12-23', 'text': 'Became Public Law No: 116-258.'}",2904,Senate,S,IOGAN Act,S,2022-10-28,2022-10-28T02:00:26Z,https://api.congress.gov/v3/bill/116/s/2904?format=json
735,181853,140,116,"{'actionDate': '2020-12-23', 'text': 'Became Public Law No: 116-257.'}",2258,Senate,S,Criminal Antitrust Anti-Retaliation Act of 2019,S,2022-11-01,2022-11-01T14:29:39Z,https://api.congress.gov/v3/bill/116/s/2258?format=json
736,181854,141,116,"{'actionDate': '2020-12-23', 'text': 'Became Public Law No: 116-255.'}",199,Senate,S,Leech Lake Band of Ojibwe Reservation Restoration Act,S,2022-11-01,2022-11-01T17:17:24Z,https://api.congress.gov/v3/bill/116/s/199?format=json
737,181855,142,116,"{'actionDate': '2020-12-23', 'text': 'Became Public Law No: 116-256.'}",1014,Senate,S,Route 66 Centennial Commission Act,S,2022-11-05,2022-11-05T19:28:00Z,https://api.congress.gov/v3/bill/116/s/1014?format=json
738,181856,143,116,"{'actionDate': '2020-12-22', 'text': 'Became Public Law No: 116-250.'}",578,Senate,S,ALS Disability Insurance Access Act of 2019,S,2022-11-01,2022-11-01T16:47:42Z,https://api.congress.gov/v3/bill/116/s/578?format=json
739,181857,144,116,"{'actionDate': '2020-12-22', 'text': 'Became Public Law No: 116-252.'}",3703,Senate,S,Promoting Alzheimer's Awareness to Prevent Elder Abuse Act,S,2022-02-08,2022-02-08T23:23:11Z,https://api.congress.gov/v3/bill/116/s/3703?format=json
740,181858,145,116,"{'actionDate': '2020-12-22', 'text': 'Became Public Law No: 116-248.'}",3349,House,H,Republic of Texas Legation Memorial Act,HR,2022-11-01,2022-11-01T13:51:01Z,https://api.congress.gov/v3/bill/116/hr/3349?format=json
741,181859,146,116,"{'actionDate': '2020-12-22', 'text': 'Became Public Law No: 116-247.'}",1830,House,H,National Purple Heart Hall of Honor Commemorative Coin Act,HR,2022-11-01,2022-11-01T18:02:32Z,https://api.congress.gov/v3/bill/116/hr/1830?format=json
742,181860,147,116,"{'actionDate': '2020-12-22', 'text': 'Became Public Law No: 116-246.'}",1520,House,H,"Further Extension of Continuing Appropriations Act, 2021",HR,2022-11-01,2022-11-01T17:03:27Z,https://api.congress.gov/v3/bill/116/hr/1520?format=json
743,181861,148,116,"{'actionDate': '2020-12-22', 'text': 'Became Public Law No: 116-249.'}",134,Senate,S,Combat Online Predators Act,S,2022-11-01,2022-11-01T14:02:53Z,https://api.congress.gov/v3/bill/116/s/134?format=json
744,181862,149,116,"{'actionDate': '2020-12-22', 'text': 'Became Public Law No: 116-251.'}",1153,Senate,S,Stop Student Debt Relief Scams Act of 2019,S,2022-11-05,2022-11-05T19:24:45Z,https://api.congress.gov/v3/bill/116/s/1153?format=json
745,181868,155,116,"{'actionDate': '2020-12-21', 'text': 'Became Public Law No: 116-244.'}",5954,House,H,"To designate the facility of the United States Postal Service located at 108 West Maple Street in Holly, Michigan, as the Holly Veterans Memorial Post Office.",HR,2022-08-10,2022-08-10T23:38:57Z,https://api.congress.gov/v3/bill/116/hr/5954?format=json
746,181869,156,116,"{'actionDate': '2020-12-21', 'text': 'Became Public Law No: 116-243.'}",5317,House,H,"To designate the facility of the United States Postal Service located at 315 Addicks Howell Road in Houston, Texas, as the Deputy Sandeep Singh Dhaliwal Post Office Building.",HR,2022-10-28,2022-10-28T01:46:05Z,https://api.congress.gov/v3/bill/116/hr/5317?format=json
747,181870,157,116,"{'actionDate': '2020-12-21', 'text': 'Became Public Law No: 116-242.'}",4971,House,H,"To designate the facility of the United States Postal Service located at 15 East Market Street in Leesburg, Virginia, as the Norman Duncan Post Office Building.",HR,2022-11-01,2022-11-01T04:47:40Z,https://api.congress.gov/v3/bill/116/hr/4971?format=json
748,181871,158,116,"{'actionDate': '2020-12-21', 'text': 'Became Public Law No: 116-245.'}",4902,Senate,S,"A bill to designate the United States courthouse located at 351 South West Temple in Salt Lake City, Utah, as the ""Orrin G. Hatch United States Courthouse"".",S,2022-08-10,2022-08-10T23:36:00Z,https://api.congress.gov/v3/bill/116/s/4902?format=json
749,181872,159,116,"{'actionDate': '2020-12-21', 'text': 'Became Public Law No: 116-241.'}",4875,House,H,"To designate the facility of the United States Postal Service located at 2201 E. Maple Street in North Canton, Ohio, as the Lance Cpl. Stacy Annie Dryden Post Office.",HR,2022-11-01,2022-11-01T04:32:34Z,https://api.congress.gov/v3/bill/116/hr/4875?format=json
750,181873,160,116,"{'actionDate': '2020-12-21', 'text': 'Became Public Law No: 116-240.'}",4785,House,H,"To designate the facility of the United States Postal Service located at 1305 U.S. Highway 90 West in Castroville, Texas, as the Lance Corporal Rhonald Dain Rairdan Post Office.",HR,2022-11-01,2022-11-01T04:17:47Z,https://api.congress.gov/v3/bill/116/hr/4785?format=json
751,181874,161,116,"{'actionDate': '2020-12-21', 'text': 'Became Public Law No: 116-239.'}",4725,House,H,"To designate the facility of the United States Postal Service located at 8585 Criterion Drive in Colorado Springs, Colorado, as the Chaplain (Capt.) Dale Goetz Memorial Post Office Building.",HR,2022-11-01,2022-11-01T03:47:36Z,https://api.congress.gov/v3/bill/116/hr/4725?format=json
752,181875,162,116,"{'actionDate': '2020-12-21', 'text': 'Became Public Law No: 116-238.'}",4672,House,H,"To designate the facility of the United States Postal Service located at 21701 Stevens Creek Boulevard in Cupertino, California, as the Petty Officer 2nd Class (SEAL) Matthew G. Axelson Post Office Building.",HR,2022-11-01,2022-11-01T13:49:40Z,https://api.congress.gov/v3/bill/116/hr/4672?format=json
753,181876,163,116,"{'actionDate': '2020-12-21', 'text': 'Became Public Law No: 116-237.'}",4279,House,H,"To designate the facility of the United States Postal Service located at 445 Main Street in Laceyville, Pennsylvania, as the Melinda Gene Piccotti Post Office.",HR,2022-11-01,2022-11-01T13:50:04Z,https://api.congress.gov/v3/bill/116/hr/4279?format=json
754,181877,164,116,"{'actionDate': '2020-12-21', 'text': 'Became Public Law No: 116-236.'}",4200,House,H,"To designate the facility of the United States Postal Service located at 321 South 1st Street in Montrose, Colorado, as the Sergeant David Kinterknecht Post Office.",HR,2022-11-01,2022-11-01T13:50:09Z,https://api.congress.gov/v3/bill/116/hr/4200?format=json
755,181878,165,116,"{'actionDate': '2020-12-21', 'text': 'Became Public Law No: 116-235.'}",4034,House,H,"To designate the facility of the United States Postal Service located at 602 Pacific Avenue in Bremerton, Washington, as the John Henry Turpin Post Office Building.",HR,2022-11-01,2022-11-01T13:50:20Z,https://api.congress.gov/v3/bill/116/hr/4034?format=json
756,181879,166,116,"{'actionDate': '2020-12-21', 'text': 'Became Public Law No: 116-234.'}",3870,House,H,"To designate the facility of the United States Postal Service located at 511 West 165th Street in New York, New York, as the Normandia Maldonado Post Office Building.",HR,2022-11-01,2022-11-01T13:50:30Z,https://api.congress.gov/v3/bill/116/hr/3870?format=json
757,181880,167,116,"{'actionDate': '2020-12-21', 'text': 'Became Public Law No: 116-233.'}",3847,House,H,"To designate the facility of the United States Postal Service located at 117 West Poythress Street in Hopewell, Virginia, as the Reverend Curtis West Harris Post Office Building.",HR,2022-11-01,2022-11-01T13:50:32Z,https://api.congress.gov/v3/bill/116/hr/3847?format=json
758,181881,168,116,"{'actionDate': '2020-12-21', 'text': 'Became Public Law No: 116-232.'}",3680,House,H,"To designate the facility of the United States Postal Service located at 415 North Main Street in Henning, Tennessee, as the ""Paula Croom Robinson and Judy Spray Memorial Post Office Building"".",HR,2022-11-01,2022-11-01T13:50:42Z,https://api.congress.gov/v3/bill/116/hr/3680?format=json
759,181882,169,116,"{'actionDate': '2020-12-21', 'text': 'Became Public Law No: 116-231.'}",3275,House,H,"To designate the facility of the United States Postal Service located at 340 Wetmore Avenue in Grand River, Ohio, as the Lance Corporal Andy Ace Nowacki Post Office.",HR,2022-11-01,2022-11-01T13:51:08Z,https://api.congress.gov/v3/bill/116/hr/3275?format=json
760,181883,170,116,"{'actionDate': '2020-12-21', 'text': 'Became Public Law No: 116-230.'}",3005,House,H,"To designate the facility of the United States Postal Service located at 13308 Midland Road in Poway, California, as the Ray Chavez Post Office Building.",HR,2022-11-01,2022-11-01T06:02:34Z,https://api.congress.gov/v3/bill/116/hr/3005?format=json
761,181884,171,116,"{'actionDate': '2020-12-21', 'text': 'Became Public Law No: 116-229.'}",2969,House,H,"To designate the facility of the United States Postal Service located at 1401 1st Street North in Winter Haven, Florida, as the Althea Margaret Daily Mills Post Office Building.",HR,2022-11-01,2022-11-01T06:02:34Z,https://api.congress.gov/v3/bill/116/hr/2969?format=json
762,181885,172,116,"{'actionDate': '2020-12-21', 'text': 'Became Public Law No: 116-228.'}",2454,House,H,"To designate the facility of the United States Postal Service located at 123 East Sharpfish Street in Rosebud, South Dakota, as the Ben Reifel Post Office Building.",HR,2022-08-10,2022-08-10T23:38:57Z,https://api.congress.gov/v3/bill/116/hr/2454?format=json
763,181886,173,116,"{'actionDate': '2020-12-21', 'text': 'Became Public Law No: 116-227.'}",2246,House,H,"To designate the facility of the United States Postal Service located at 201 West Cherokee Street in Brookhaven, Mississippi, as the Deputy Donald William Durr, Corporal Zach Moak, and Patrolman James White Memorial Post Office Building.",HR,2022-11-01,2022-11-01T19:32:18Z,https://api.congress.gov/v3/bill/116/hr/2246?format=json
764,181922,209,116,"{'actionDate': '2020-12-20', 'text': 'Became Public Law No: 116-226.'}",110,House,H,"Extension of Continuing Appropriations Act, 2021",HJRES,2022-08-25,2022-08-25T18:29:12Z,https://api.congress.gov/v3/bill/116/hjres/110?format=json
765,181934,221,116,"{'actionDate': '2020-12-18', 'text': 'Became Public Law No: 116-222.'}",945,Senate,S,Holding Foreign Companies Accountable Act,S,2022-11-05,2022-11-05T19:29:30Z,https://api.congress.gov/v3/bill/116/s/945?format=json
766,181935,222,116,"{'actionDate': '2020-12-18', 'text': 'Became Public Law No: 116-221.'}",910,Senate,S,National Sea Grant College Program Amendments Act of 2020,S,2022-11-01,2022-11-01T18:32:40Z,https://api.congress.gov/v3/bill/116/s/910?format=json
767,181936,223,116,"{'actionDate': '2020-12-18', 'text': 'Became Public Law No: 116-224.'}",1982,Senate,S,Save Our Seas 2.0 Act,S,2022-11-01,2022-11-01T13:50:53Z,https://api.congress.gov/v3/bill/116/s/1982?format=json
768,181937,224,116,"{'actionDate': '2020-12-18', 'text': 'Became Public Law No: 116-225.'}",107,House,H,"Further Additional Continuing Appropriations Act, 2021",HJRES,2022-08-25,2022-08-25T18:29:12Z,https://api.congress.gov/v3/bill/116/hjres/107?format=json
769,181938,225,116,"{'actionDate': '2020-12-18', 'text': 'Became Public Law No: 116-223.'}",1069,Senate,S,Digital Coast Act,S,2022-11-01,2022-11-01T19:32:21Z,https://api.congress.gov/v3/bill/116/s/1069?format=json
770,181991,28,116,"{'actionDate': '2020-12-17', 'text': 'Became Public Law No: 116-220.'}",5307,House,H,"To designate the facility of the United States Postal Service located at 115 Nicol Avenue in Thomasville, Alabama, as the ""Postmaster Robert Ingram Post Office"".",HR,2022-10-28,2022-10-28T01:46:05Z,https://api.congress.gov/v3/bill/116/hr/5307?format=json
771,181992,29,116,"{'actionDate': '2020-12-17', 'text': 'Became Public Law No: 116-219.'}",5062,House,H,"To designate the facility of the United States Postal Service located at 9930 Conroy Windermere Road in Windermere, Florida, as the Officer Robert German Post Office Building.",HR,2022-11-01,2022-11-01T05:17:27Z,https://api.congress.gov/v3/bill/116/hr/5062?format=json
772,181993,30,116,"{'actionDate': '2020-12-17', 'text': 'Became Public Law No: 116-218.'}",4975,House,H,"To designate the facility of the United States Postal Service located at 1201 Sycamore Square Drive in Midlothian, Virginia, as the Dorothy Braden Bruce Post Office Building.",HR,2022-11-01,2022-11-01T04:47:40Z,https://api.congress.gov/v3/bill/116/hr/4975?format=json
773,181994,31,116,"{'actionDate': '2020-12-17', 'text': 'Became Public Law No: 116-217.'}",473,House,H,"To authorize the Every Word We Utter Monument to establish a commemorative work in the District of Columbia and its environs, and for other purposes.",HR,2022-11-01,2022-11-01T13:49:17Z,https://api.congress.gov/v3/bill/116/hr/473?format=json
774,182195,232,116,"{'actionDate': '2020-12-11', 'text': 'Became Public Law No: 116-215.'}",8900,House,H,"Further Continuing Appropriations Act, 2021, and Other Extensions Act",HR,2022-08-25,2022-08-25T18:29:12Z,https://api.congress.gov/v3/bill/116/hr/8900?format=json
775,182403,190,116,"{'actionDate': '2020-12-05', 'text': 'Became Public Law No: 116-214.'}",8247,House,H,Veterans COMPACT Act of 2020,HR,2022-08-10,2022-08-10T23:25:36Z,https://api.congress.gov/v3/bill/116/hr/8247?format=json
776,182404,191,116,"{'actionDate': '2020-12-04', 'text': 'Became Public Law No: 116-211.'}",8472,House,H,Impact Aid Coronavirus Relief Act,HR,2022-02-09,2022-02-09T09:23:53Z,https://api.congress.gov/v3/bill/116/hr/8472?format=json
777,182405,192,116,"{'actionDate': '2020-12-04', 'text': 'Became Public Law No: 116-206.'}",835,House,H,Rodchenkov Anti-Doping Act of 2019,HR,2022-11-01,2022-11-01T15:02:55Z,https://api.congress.gov/v3/bill/116/hr/835?format=json
778,182406,193,116,"{'actionDate': '2020-12-04', 'text': 'Became Public Law No: 116-210.'}",8276,House,H,To authorize the President to posthumously award the Medal of Honor to Alwyn C. Cashe for acts of valor during Operation Iraqi Freedom.,HR,2022-02-09,2022-02-09T07:33:30Z,https://api.congress.gov/v3/bill/116/hr/8276?format=json
779,182407,194,116,"{'actionDate': '2020-12-04', 'text': 'Became Public Law No: 116-209.'}",4104,House,H,Negro Leagues Baseball Centennial Commemorative Coin Act,HR,2022-11-01,2022-11-01T13:50:17Z,https://api.congress.gov/v3/bill/116/hr/4104?format=json
780,182408,195,116,"{'actionDate': '2020-12-04', 'text': 'Became Public Law No: 116-208.'}",3589,House,H,Greg LeMond Congressional Gold Medal Act,HR,2022-11-01,2022-11-01T13:49:57Z,https://api.congress.gov/v3/bill/116/hr/3589?format=json
781,182409,196,116,"{'actionDate': '2020-12-04', 'text': 'Became Public Law No: 116-213.'}",3587,Senate,S,Department of Veterans Affairs Website Accessibility Act of 2019,S,2022-02-09,2022-02-09T07:31:36Z,https://api.congress.gov/v3/bill/116/s/3587?format=json
782,182410,197,116,"{'actionDate': '2020-12-04', 'text': 'Became Public Law No: 116-212.'}",3147,Senate,S,Improving Safety and Security for Veterans Act of 2019,S,2022-10-28,2022-10-28T01:46:15Z,https://api.congress.gov/v3/bill/116/s/3147?format=json
783,182411,198,116,"{'actionDate': '2020-12-04', 'text': 'Became Public Law No: 116-207.'}",1668,House,H,IoT Cybersecurity Improvement Act of 2020,HR,2022-11-01,2022-11-01T17:32:22Z,https://api.congress.gov/v3/bill/116/hr/1668?format=json
784,182428,215,116,"{'actionDate': '2020-12-03', 'text': 'Became Public Law No: 116-194.'}",5901,House,H,Information Technology Modernization Centers of Excellence Program Act,HR,2022-08-10,2022-08-10T23:38:57Z,https://api.congress.gov/v3/bill/116/hr/5901?format=json
785,182429,216,116,"{'actionDate': '2020-12-03', 'text': 'Became Public Law No: 116-204.'}",5384,House,H,"To designate the facility of the United States Postal Service located at 100 Crosby Street in Mansfield, Louisiana, as the Dr. C.O. Simpkins, Sr., Post Office.",HR,2022-10-28,2022-10-28T01:46:00Z,https://api.congress.gov/v3/bill/116/hr/5384?format=json
786,182430,217,116,"{'actionDate': '2020-12-03', 'text': 'Became Public Law No: 116-203.'}",5037,House,H,"To designate the facility of the United States Postal Service located at 3703 North Main Street in Farmville, North Carolina, as the Walter B. Jones, Jr. Post Office.",HR,2022-11-01,2022-11-01T05:02:32Z,https://api.congress.gov/v3/bill/116/hr/5037?format=json
787,182431,218,116,"{'actionDate': '2020-12-03', 'text': 'Became Public Law No: 116-202.'}",4981,House,H,"To designate the facility of the United States Postal Service located at 2505 Derita Avenue in Charlotte, North Carolina, as the Julius L. Chambers Civil Rights Memorial Post Office.",HR,2022-11-01,2022-11-01T05:02:37Z,https://api.congress.gov/v3/bill/116/hr/4981?format=json
788,182432,219,116,"{'actionDate': '2020-12-03', 'text': 'Became Public Law No: 116-201.'}",4794,House,H,"To designate the facility of the United States Postal Service located at 8320 13th Avenue in Brooklyn, New York, as the Mother Frances Xavier Cabrini Post Office Building.",HR,2022-11-01,2022-11-01T04:17:47Z,https://api.congress.gov/v3/bill/116/hr/4794?format=json
789,182433,220,116,"{'actionDate': '2020-12-03', 'text': 'Became Public Law No: 116-200.'}",4734,House,H,"To designate the facility of the United States Postal Service located at 171 South Maple Street in Dana, Indiana, as the Ernest Ernie T. Pyle Post Office.",HR,2022-11-01,2022-11-01T03:47:34Z,https://api.congress.gov/v3/bill/116/hr/4734?format=json
790,182434,221,116,"{'actionDate': '2020-12-03', 'text': 'Became Public Law No: 116-199.'}",3329,House,H,"To designate the facility of the United States Postal Service located at 5186 Benito Street in Montclair, California, as the Paul Eaton Post Office Building.",HR,2022-11-01,2022-11-01T13:49:39Z,https://api.congress.gov/v3/bill/116/hr/3329?format=json
791,182435,222,116,"{'actionDate': '2020-12-03', 'text': 'Became Public Law No: 116-198.'}",3317,House,H,"To permit the Scipio A. Jones Post Office in Little Rock, Arkansas, to accept and display a portrait of Scipio A. Jones, and for other purposes.",HR,2022-11-01,2022-11-01T13:51:05Z,https://api.congress.gov/v3/bill/116/hr/3317?format=json
792,182436,223,116,"{'actionDate': '2020-12-03', 'text': 'Became Public Law No: 116-205.'}",327,Senate,S,Wounded Veterans Recreation Act,S,2022-11-01,2022-11-01T15:32:56Z,https://api.congress.gov/v3/bill/116/s/327?format=json
793,182437,224,116,"{'actionDate': '2020-12-03', 'text': 'Became Public Law No: 116-197.'}",3207,House,H,"To designate the facility of the United States Postal Service located at 114 Mill Street in Hookstown, Pennsylvania, as the ""Staff Sergeant Dylan Elchin Post Office Building"".",HR,2022-11-01,2022-11-01T13:49:40Z,https://api.congress.gov/v3/bill/116/hr/3207?format=json
794,182438,225,116,"{'actionDate': '2020-12-03', 'text': 'Became Public Law No: 116-196.'}",1833,House,H,"To designate the facility of the United States Postal Service located at 35 Tulip Avenue in Floral Park, New York, as the Lieutenant Michael R. Davidson Post Office Building.",HR,2022-11-01,2022-11-01T18:02:32Z,https://api.congress.gov/v3/bill/116/hr/1833?format=json
795,182439,226,116,"{'actionDate': '2020-12-03', 'text': 'Became Public Law No: 116-195.'}",1773,House,H,Rosie the Riveter Congressional Gold Medal Act of 2019,HR,2022-11-01,2022-11-01T18:02:34Z,https://api.congress.gov/v3/bill/116/hr/1773?format=json
796,182878,165,116,"{'actionDate': '2020-10-30', 'text': 'Became Public Law No: 116-183.'}",561,House,H,Protecting Business Opportunities for Veterans Act of 2019,HR,2022-11-01,2022-11-01T14:02:52Z,https://api.congress.gov/v3/bill/116/hr/561?format=json
797,182879,166,116,"{'actionDate': '2020-10-30', 'text': 'Became Public Law No: 116-193.'}",4762,Senate,S,"A bill to designate the airport traffic control tower located at Piedmont Triad International Airport in Greensboro, North Carolina, as the ""Senator Kay Hagan Airport Traffic Control Tower"".",S,2022-08-10,2022-08-10T23:36:00Z,https://api.congress.gov/v3/bill/116/s/4762?format=json
798,182880,167,116,"{'actionDate': '2020-10-30', 'text': 'Became Public Law No: 116-187.'}",4183,House,H,Identifying Barriers and Best Practices Study Act,HR,2022-11-01,2022-11-01T13:50:10Z,https://api.congress.gov/v3/bill/116/hr/4183?format=json
