,index,Unnamed: 0,congress,latestAction,number,originChamber,originChamberCode,title,type,updateDate,updateDateIncludingText,url
532,17737,181,117,"{'actionDate': '2022-05-09', 'text': 'Became Public Law No: 117-118.'}",3522,Senate,S,Ukraine Democracy Defense Lend-Lease Act of 2022,S,2022-09-29,2022-09-29T03:27:18Z,https://api.congress.gov/v3/bill/117/s/3522?format=json
533,17750,194,117,"{'actionDate': '2022-05-06', 'text': 'Became Public Law No: 117-117.'}",400,Senate,S,"William T. Coleman, Jr. and Norman Y. Mineta Department of Transportation Headquarters Act",S,2022-09-07,2022-09-07T13:36:44Z,https://api.congress.gov/v3/bill/117/s/400?format=json
534,17773,217,117,"{'actionDate': '2022-05-05', 'text': 'Became Public Law No: 117-116.'}",2629,Senate,S,Better Cybercrime Metrics Act,S,2022-09-07,2022-09-07T13:38:12Z,https://api.congress.gov/v3/bill/117/s/2629?format=json
535,17774,218,117,"{'actionDate': '2022-05-05', 'text': 'Became Public Law No: 117-115.'}",233,Senate,S,Donna M. Doss Memorial Act of 2021,S,2022-09-07,2022-09-07T13:37:00Z,https://api.congress.gov/v3/bill/117/s/233?format=json
536,17864,58,117,"{'actionDate': '2022-04-29', 'text': 'Became Public Law No: 117-114.'}",3113,House,H,Modernizing Access to Our Public Land Act,HR,2022-09-29,2022-09-29T03:56:28Z,https://api.congress.gov/v3/bill/117/hr/3113?format=json
537,18055,249,117,"{'actionDate': '2022-04-19', 'text': 'Became Public Law No: 117-113.'}",5681,House,H,Shadow Wolves Enhancement Act,HR,2022-09-29,2022-09-29T02:57:39Z,https://api.congress.gov/v3/bill/117/hr/5681?format=json
538,18056,0,117,"{'actionDate': '2022-04-19', 'text': 'Became Public Law No: 117-112.'}",3197,House,H,Save the Liberty Theatre Act of 2021,HR,2022-09-29,2022-09-29T03:56:29Z,https://api.congress.gov/v3/bill/117/hr/3197?format=json
539,18108,52,117,"{'actionDate': '2022-04-13', 'text': 'Became Public Law No: 117-111.'}",3294,Senate,S,A bill to obtain and direct the placement in the Capitol or on the Capitol Grounds of a statue to honor Associate Justice of the Supreme Court of the United States Sandra Day O'Connor and a statue to honor Associate Justice of the Supreme Court of the United States Ruth Bader Ginsburg.,S,2022-09-07,2022-09-07T13:37:55Z,https://api.congress.gov/v3/bill/117/s/3294?format=json
540,18121,65,117,"{'actionDate': '2022-04-08', 'text': 'Became Public Law No: 117-110.'}",7108,House,H,Suspending Normal Trade Relations with Russia and Belarus Act,HR,2022-09-07,2022-09-07T13:35:36Z,https://api.congress.gov/v3/bill/117/hr/7108?format=json
541,18122,66,117,"{'actionDate': '2022-04-08', 'text': 'Became Public Law No: 117-109.'}",6968,House,H,Ending Importation of Russian Oil Act,HR,2022-09-29,2022-09-29T02:57:41Z,https://api.congress.gov/v3/bill/117/hr/6968?format=json
542,18245,189,117,"{'actionDate': '2022-04-06', 'text': 'Became Public Law No: 117-108.'}",3076,House,H,Postal Service Reform Act of 2022,HR,2022-09-29,2022-09-29T03:27:05Z,https://api.congress.gov/v3/bill/117/hr/3076?format=json
543,18542,236,117,"{'actionDate': '2022-03-29', 'text': 'Became Public Law No: 117-107.'}",55,House,H,Emmett Till Antilynching Act,HR,2022-11-17,2022-11-17T17:58:42Z,https://api.congress.gov/v3/bill/117/hr/55?format=json
544,18768,212,117,"{'actionDate': '2022-03-18', 'text': 'Became Public Law No: 117-106.'}",2497,House,H,Amache National Historic Site Act,HR,2022-09-29,2022-09-29T03:56:16Z,https://api.congress.gov/v3/bill/117/hr/2497?format=json
545,18769,213,117,"{'actionDate': '2022-03-18', 'text': 'Became Public Law No: 117-104.'}",189,House,H,John Lewis NIMHD Research Endowment Revitalization Act of 2021,HR,2022-09-07,2022-09-07T13:37:09Z,https://api.congress.gov/v3/bill/117/hr/189?format=json
546,18770,214,117,"{'actionDate': '2022-03-18', 'text': 'Became Public Law No: 117-105.'}",1667,House,H,Dr. Lorna Breen Health Care Provider Protection Act,HR,2022-09-29,2022-09-29T02:57:35Z,https://api.congress.gov/v3/bill/117/hr/1667?format=json
547,18902,96,117,"{'actionDate': '2022-03-15', 'text': 'Became Public Law No: 117-102.'}",3706,Senate,S,A bill to provide for the application of certain provisions of the Secure Rural Schools and Community Self-Determination Act of 2000 for fiscal year 2021.,S,2022-09-07,2022-09-07T13:35:56Z,https://api.congress.gov/v3/bill/117/s/3706?format=json
548,18903,97,117,"{'actionDate': '2022-03-15', 'text': 'Became Public Law No: 117-103.'}",2471,House,H,"Consolidated Appropriations Act, 2022",HR,2022-11-17,2022-11-17T19:00:19Z,https://api.congress.gov/v3/bill/117/hr/2471?format=json
549,18904,98,117,"{'actionDate': '2022-03-15', 'text': 'Became Public Law No: 117-101.'}",1662,Senate,S,Supporting the Foundation for the National Institutes of Health and the Reagan-Udall Foundation for the Food and Drug Administration Act,S,2022-09-29,2022-09-29T03:12:38Z,https://api.congress.gov/v3/bill/117/s/1662?format=json
550,18905,99,117,"{'actionDate': '2022-03-15', 'text': 'Became Public Law No: 117-100.'}",1543,Senate,S,STANDUP Act of 2021,S,2022-09-07,2022-09-07T13:36:39Z,https://api.congress.gov/v3/bill/117/s/1543?format=json
551,18934,128,117,"{'actionDate': '2022-03-14', 'text': 'Became Public Law No: 117-99.'}",854,Senate,S,Methamphetamine Response Act of 2021,S,2022-09-07,2022-09-07T13:38:38Z,https://api.congress.gov/v3/bill/117/s/854?format=json
552,18935,129,117,"{'actionDate': '2022-03-14', 'text': 'Became Public Law No: 117-98.'}",3665,House,H,"To designate the medical center of the Department of Veterans Affairs in San Diego, California, as the Jennifer Moreno Department of Veterans Affairs Medical Center, and to support the designation of a component of such medical center in honor of Kathleen Bruyere.",HR,2022-09-07,2022-09-07T13:38:27Z,https://api.congress.gov/v3/bill/117/hr/3665?format=json
553,18936,130,117,"{'actionDate': '2022-03-14', 'text': 'Became Public Law No: 117-97.'}",321,Senate,S,'Six Triple Eight' Congressional Gold Medal Act of 2021,S,2022-11-15,2022-11-15T03:26:16Z,https://api.congress.gov/v3/bill/117/s/321?format=json
554,18937,131,117,"{'actionDate': '2022-03-14', 'text': 'Became Public Law No: 117-96.'}",2545,House,H,"To amend title 38, United States Code, to clarify the role of doctors of podiatric medicine in the Department of Veterans Affairs, and for other purposes.",HR,2022-09-07,2022-09-07T13:37:23Z,https://api.congress.gov/v3/bill/117/hr/2545?format=json
555,18954,148,117,"{'actionDate': '2022-03-11', 'text': 'Became Public Law No: 117-93.'}",960,House,H,"To designate the facility of the United States Postal Service located at 3493 Burnet Avenue in Cincinnati, Ohio, as the John H. Leahr and Herbert M. Heilbrun Post Office.",HR,2022-09-07,2022-09-07T13:38:12Z,https://api.congress.gov/v3/bill/117/hr/960?format=json
556,18955,149,117,"{'actionDate': '2022-03-11', 'text': 'Became Public Law No: 117-95.'}",75,House,H,"Extension of Continuing Appropriations Act, 2022",HJRES,2022-09-29,2022-09-29T02:57:41Z,https://api.congress.gov/v3/bill/117/hjres/75?format=json
557,18956,150,117,"{'actionDate': '2022-03-11', 'text': 'Became Public Law No: 117-94.'}",3419,House,H,"To designate the facility of the United States Postal Service located at 66 Meserole Avenue in Brooklyn, New York, as the Joseph R. Lentol Post Office.",HR,2022-09-07,2022-09-07T13:38:08Z,https://api.congress.gov/v3/bill/117/hr/3419?format=json
558,18974,168,117,"{'actionDate': '2022-03-10', 'text': 'Became Public Law No: 117-92.'}",3210,House,H,"To designate the facility of the United States Postal Service located at 1905 15th Street in Boulder, Colorado, as the ""Officer Eric H. Talley Post Office Building"".",HR,2022-09-21,2022-09-21T15:12:45Z,https://api.congress.gov/v3/bill/117/hr/3210?format=json
559,18975,169,117,"{'actionDate': '2022-03-10', 'text': 'Became Public Law No: 117-91.'}",2044,House,H,"To designate the facility of the United States Postal Service located at 17 East Main Street in Herington, Kansas, as the Captain Emil J. Kapaun Post Office Building.",HR,2022-09-07,2022-09-07T13:37:42Z,https://api.congress.gov/v3/bill/117/hr/2044?format=json
560,19166,110,117,"{'actionDate': '2022-03-03', 'text': 'Became Public Law No: 117-90.'}",4445,House,H,Ending Forced Arbitration of Sexual Assault and Sexual Harassment Act of 2021,HR,2022-09-29,2022-09-29T02:57:38Z,https://api.congress.gov/v3/bill/117/hr/4445?format=json
561,19369,63,117,"{'actionDate': '2022-02-23', 'text': 'Became Public Law No: 117-89.'}",1281,House,H,"To name the Department of Veterans Affairs community-based outpatient clinic in Gaylord, Michigan, as the Navy Corpsman Steve Andrews Department of Veterans Affairs Health Care Clinic.",HR,2022-09-07,2022-09-07T13:38:32Z,https://api.congress.gov/v3/bill/117/hr/1281?format=json
562,19376,70,117,"{'actionDate': '2022-02-22', 'text': 'Became Public Law No: 117-88.'}",583,Senate,S,PRICE Act of 2021,S,2022-09-29,2022-09-29T03:56:20Z,https://api.congress.gov/v3/bill/117/s/583?format=json
563,19377,71,117,"{'actionDate': '2022-02-22', 'text': 'Became Public Law No: 117-87.'}",566,Senate,S,"A bill to designate the facility of the United States Postal Service located at 42 Main Street in Slatersville, Rhode Island, as the ""Specialist Matthew R. Turcotte Post Office"".",S,2022-09-29,2022-09-29T03:41:43Z,https://api.congress.gov/v3/bill/117/s/566?format=json
564,19429,123,117,"{'actionDate': '2022-02-18', 'text': 'Became Public Law No: 117-86.'}",6617,House,H,Further Additional Extending Government Funding Act,HR,2022-09-29,2022-09-29T02:57:39Z,https://api.congress.gov/v3/bill/117/hr/6617?format=json
565,19881,75,117,"{'actionDate': '2022-02-01', 'text': 'Became Public Law No: 117-85.'}",1404,Senate,S,Ghost Army Congressional Gold Medal Act,S,2022-09-07,2022-09-07T13:40:09Z,https://api.congress.gov/v3/bill/117/s/1404?format=json
566,19914,108,117,"{'actionDate': '2022-01-31', 'text': 'Became Public Law No: 117-84.'}",452,Senate,S,Willie O'Ree Congressional Gold Medal Act,S,2022-09-29,2022-09-29T03:41:43Z,https://api.congress.gov/v3/bill/117/s/452?format=json
567,19984,178,117,"{'actionDate': '2022-01-21', 'text': 'Became Public Law No: 117-83.'}",2959,Senate,S,Supplemental Impact Aid Flexibility Act,S,2022-09-07,2022-09-07T13:40:44Z,https://api.congress.gov/v3/bill/117/s/2959?format=json
568,19996,190,117,"{'actionDate': '2022-01-20', 'text': 'Became Public Law No: 117-82.'}",1192,House,H,Puerto Rico Recovery Accuracy in Disclosures Act of 2021,HR,2022-09-29,2022-09-29T03:41:50Z,https://api.congress.gov/v3/bill/117/hr/1192?format=json
569,20243,187,117,"{'actionDate': '2021-12-27', 'text': 'Became Public Law No: 117-80.'}",1664,House,H,"To authorize the National Medal of Honor Museum Foundation to establish a commemorative work in the District of Columbia and its environs, and for other purposes.",HR,2022-09-29,2022-09-29T03:56:16Z,https://api.congress.gov/v3/bill/117/hr/1664?format=json
570,20244,188,117,"{'actionDate': '2021-12-27', 'text': 'Became Public Law No: 117-81.'}",1605,Senate,S,National Defense Authorization Act for Fiscal Year 2022,S,2022-09-29,2022-09-29T03:56:15Z,https://api.congress.gov/v3/bill/117/s/1605?format=json
571,20252,196,117,"{'actionDate': '2021-12-23', 'text': 'Became Public Law No: 117-78.'}",6256,House,H,"To ensure that goods made with forced labor in the Xinjiang Uyghur Autonomous Region of the Peoples Republic of China do not enter the United States market, and for other purposes.",HR,2022-09-07,2022-09-07T13:37:35Z,https://api.congress.gov/v3/bill/117/hr/6256?format=json
572,20253,197,117,"{'actionDate': '2021-12-23', 'text': 'Became Public Law No: 117-79.'}",3537,House,H,Accelerating Access to Critical Therapies for ALS Act,HR,2022-09-29,2022-09-29T03:12:41Z,https://api.congress.gov/v3/bill/117/hr/3537?format=json
573,20261,205,117,"{'actionDate': '2021-12-22', 'text': 'Became Public Law No: 117-77.'}",3377,Senate,S,Capitol Police Emergency Assistance Act of 2021,S,2022-09-07,2022-09-07T13:38:51Z,https://api.congress.gov/v3/bill/117/s/3377?format=json
574,20264,208,117,"{'actionDate': '2021-12-21', 'text': 'Became Public Law No: 117-76.'}",5545,House,H,REMOTE Act,HR,2022-11-10,2022-11-10T13:41:17Z,https://api.congress.gov/v3/bill/117/hr/5545?format=json
575,20265,209,117,"{'actionDate': '2021-12-21', 'text': 'Became Public Law No: 117-75.'}",4660,House,H,"To designate the Federal Building and United States Courthouse located at 1125 Chapline Street in Wheeling, West Virginia, as the Frederick P. Stamp, Jr. Federal Building and United States Courthouse.",HR,2022-09-29,2022-09-29T03:12:36Z,https://api.congress.gov/v3/bill/117/hr/4660?format=json
576,20266,210,117,"{'actionDate': '2021-12-21', 'text': 'Became Public Law No: 117-74.'}",390,House,H,"To redesignate the Federal building located at 167 North Main Street in Memphis, Tennessee as the ""Odell Horton Federal Building"".",HR,2022-09-29,2022-09-29T03:12:35Z,https://api.congress.gov/v3/bill/117/hr/390?format=json
577,20316,10,117,"{'actionDate': '2021-12-16', 'text': 'Became Public Law No: 117-72.'}",5142,House,H,"To award posthumously a Congressional Gold Medal, in commemoration to the servicemembers who perished in Afghanistan on August 26, 2021, during the evacuation of citizens of the United States and Afghan allies at Hamid Karzai International Airport, and for other purposes.",HR,2022-09-07,2022-09-07T13:36:55Z,https://api.congress.gov/v3/bill/117/hr/5142?format=json
578,20317,11,117,"{'actionDate': '2021-12-16', 'text': 'Became Public Law No: 117-73.'}",33,Senate,S,A joint resolution joint resolution relating to increasing the debt limit.,SJRES,2022-09-29,2022-09-29T02:57:36Z,https://api.congress.gov/v3/bill/117/sjres/33?format=json
579,20470,164,117,"{'actionDate': '2021-12-10', 'text': 'Became Public Law No: 117-71.'}",610,Senate,S,Protecting Medicare and American Farmers from Sequester Cuts Act,S,2022-09-29,2022-09-29T03:12:41Z,https://api.congress.gov/v3/bill/117/s/610?format=json
580,20670,114,117,"{'actionDate': '2021-12-03', 'text': 'Became Public Law No: 117-70.'}",6119,House,H,"Further Extending Government Funding 
Act",HR,2022-09-29,2022-09-29T03:12:40Z,https://api.congress.gov/v3/bill/117/hr/6119?format=json
581,20770,214,117,"{'actionDate': '2021-11-30', 'text': 'Became Public Law No: 117-67.'}",894,Senate,S,Hire Veteran Health Heroes Act of 2021,S,2022-09-07,2022-09-07T13:37:53Z,https://api.congress.gov/v3/bill/117/s/894?format=json
582,20771,215,117,"{'actionDate': '2021-11-30', 'text': 'Became Public Law No: 117-69.'}",796,Senate,S,Protecting Moms Who Served Act of 2021,S,2022-10-01,2022-10-01T01:30:40Z,https://api.congress.gov/v3/bill/117/s/796?format=json
583,20772,216,117,"{'actionDate': '2021-11-30', 'text': 'Became Public Law No: 117-68.'}",1095,Senate,S,Colonel John M. McHugh Tuition Fairness for Survivors Act of 2021,S,2022-09-07,2022-09-07T13:38:27Z,https://api.congress.gov/v3/bill/117/s/1095?format=json
584,20773,217,117,"{'actionDate': '2021-11-30', 'text': 'Became Public Law No: 117-66.'}",1031,Senate,S,"A bill to require the Comptroller General of the United States to conduct a study on disparities associated with race and ethnicity with respect to certain benefits administered by the Secretary of Veterans Affairs, and for other purposes.",S,2022-09-29,2022-09-29T03:56:20Z,https://api.congress.gov/v3/bill/117/s/1031?format=json
585,20826,20,117,"{'actionDate': '2021-11-23', 'text': 'Became Public Law No: 117-64.'}",1510,House,H,To direct the Secretary of Veterans Affairs to submit to Congress a report on the use of cameras in medical facilities of the Department of Veterans Affairs.,HR,2022-09-07,2022-09-07T13:37:22Z,https://api.congress.gov/v3/bill/117/hr/1510?format=json
586,20827,21,117,"{'actionDate': '2021-11-23', 'text': 'Became Public Law No: 117-65.'}",108,Senate,S,"A bill to authorize the Seminole Tribe of Florida to lease or transfer certain land, and for other purposes.",S,2022-09-29,2022-09-29T03:27:31Z,https://api.congress.gov/v3/bill/117/s/108?format=json
587,20837,31,117,"{'actionDate': '2021-11-22', 'text': 'Became Public Law No: 117-63.'}",2911,House,H,VA Transparency & Trust Act of 2021,HR,2022-09-07,2022-09-07T13:36:48Z,https://api.congress.gov/v3/bill/117/hr/2911?format=json
588,20838,32,117,"{'actionDate': '2021-11-22', 'text': 'Became Public Law No: 117-62.'}",2093,House,H,Veterans and Family Information Act,HR,2022-09-07,2022-09-07T13:36:34Z,https://api.congress.gov/v3/bill/117/hr/2093?format=json
589,20869,63,117,"{'actionDate': '2021-11-18', 'text': 'Became Public Law No: 117-59.'}",921,Senate,S,Jaime Zapata and Victor Avila Federal Officers and Employees Protection Act,S,2022-09-07,2022-09-07T13:37:42Z,https://api.congress.gov/v3/bill/117/s/921?format=json
590,20870,64,117,"{'actionDate': '2021-11-18', 'text': 'Became Public Law No: 117-61.'}",1511,Senate,S,Protecting America's First Responders Act of 2021,S,2022-09-07,2022-09-07T13:41:30Z,https://api.congress.gov/v3/bill/117/s/1511?format=json
591,20871,65,117,"{'actionDate': '2021-11-18', 'text': 'Became Public Law No: 117-60.'}",1502,Senate,S,COPS Counseling Act,S,2022-09-29,2022-09-29T03:41:43Z,https://api.congress.gov/v3/bill/117/s/1502?format=json
592,21066,10,117,"{'actionDate': '2021-11-12', 'text': 'Became Public Law No: 117-57.'}",4172,House,H,"To name the Department of Veterans Affairs community-based outpatient clinic in Aurora, Colorado, as the Lieutenant Colonel John W. Mosley VA Clinic.",HR,2022-09-07,2022-09-07T13:41:01Z,https://api.congress.gov/v3/bill/117/hr/4172?format=json
593,21067,11,117,"{'actionDate': '2021-11-12', 'text': 'Became Public Law No: 117-56.'}",3475,House,H,"To name the Department of Veterans Affairs community-based outpatient clinic in Columbus, Georgia, as the Robert S. Poydasheff VA Clinic.",HR,2022-09-07,2022-09-07T13:37:27Z,https://api.congress.gov/v3/bill/117/hr/3475?format=json
594,21075,19,117,"{'actionDate': '2021-11-11', 'text': 'Became Public Law No: 117-55.'}",3919,House,H,Secure Equipment Act of 2021,HR,2022-09-29,2022-09-29T03:12:34Z,https://api.congress.gov/v3/bill/117/hr/3919?format=json
595,21076,20,117,"{'actionDate': '2021-11-10', 'text': 'Became Public Law No: 117-53.'}",1899,House,H,Ensuring Compliance Against Drug Diversion Act of 2021,HR,2022-09-07,2022-09-07T13:39:59Z,https://api.congress.gov/v3/bill/117/hr/1899?format=json
596,21077,21,117,"{'actionDate': '2021-11-10', 'text': 'Became Public Law No: 117-54.'}",1064,Senate,S,RENACER Act,S,2022-09-29,2022-09-29T03:41:41Z,https://api.congress.gov/v3/bill/117/s/1064?format=json
597,21437,131,117,"{'actionDate': '2021-10-31', 'text': 'Became Public Law No: 117-52.'}",5763,House,H,Further Surface Transportation Extension Act of 2021,HR,2022-09-21,2022-09-21T13:17:22Z,https://api.congress.gov/v3/bill/117/hr/5763?format=json
598,21775,219,117,"{'actionDate': '2021-10-19', 'text': 'Became Public Law No: 117-51.'}",4981,House,H,"To amend the Fentanyl Sanctions Act, to modify certain deadlines relating to the Commission on Combating Synthetic Opioid Trafficking.",HR,2022-09-29,2022-09-29T03:27:08Z,https://api.congress.gov/v3/bill/117/hr/4981?format=json
599,21977,171,117,"{'actionDate': '2021-10-14', 'text': 'Became Public Law No: 117-50.'}",1301,Senate,S,Promoting Physical Activity for Americans Act,S,2022-09-29,2022-09-29T03:12:33Z,https://api.congress.gov/v3/bill/117/s/1301?format=json
600,21990,184,117,"{'actionDate': '2021-10-13', 'text': 'Became Public Law No: 117-49.'}",848,Senate,S,Consider Teachers Act of 2021,S,2022-09-07,2022-09-07T13:37:58Z,https://api.congress.gov/v3/bill/117/s/848?format=json
601,21991,185,117,"{'actionDate': '2021-10-13', 'text': 'Became Public Law No: 117-48.'}",2278,House,H,"To designate the September 11th National Memorial Trail Route, and for other purposes.",HR,2022-09-29,2022-09-29T02:42:45Z,https://api.congress.gov/v3/bill/117/hr/2278?format=json
602,22052,246,117,"{'actionDate': '2021-10-08', 'text': 'Became Public Law No: 117-47.'}",1917,Senate,S,K-12 Cybersecurity Act of 2021,S,2022-09-29,2022-09-29T03:41:39Z,https://api.congress.gov/v3/bill/117/s/1917?format=json
603,22053,247,117,"{'actionDate': '2021-10-08', 'text': 'Became Public Law No: 117-45.'}",189,Senate,S,Veterans' Compensation Cost-of-Living Adjustment Act of 2021,S,2022-09-29,2022-09-29T03:56:20Z,https://api.congress.gov/v3/bill/117/s/189?format=json
604,22054,248,117,"{'actionDate': '2021-10-08', 'text': 'Became Public Law No: 117-46.'}",1828,Senate,S,Helping American Victims Afflicted by Neurological Attacks Act of 2021,S,2022-09-29,2022-09-29T03:41:43Z,https://api.congress.gov/v3/bill/117/s/1828?format=json
605,22222,166,117,"{'actionDate': '2021-10-02', 'text': 'Became Public Law No: 117-44.'}",5434,House,H,"Surface Transportation Extension Act 
of 2021",HR,2022-09-07,2022-09-07T13:40:01Z,https://api.congress.gov/v3/bill/117/hr/5434?format=json
606,22251,195,117,"{'actionDate': '2021-09-30', 'text': 'Became Public Law No: 117-43.'}",5305,House,H,Extending Government Funding and Delivering Emergency Assistance Act,HR,2022-09-29,2022-09-29T03:12:32Z,https://api.congress.gov/v3/bill/117/hr/5305?format=json
607,22252,196,117,"{'actionDate': '2021-09-30', 'text': 'Became Public Law No: 117-42.'}",5293,House,H,Department of Veterans Affairs Expiring Authorities Act of 2021,HR,2022-09-07,2022-09-07T13:41:01Z,https://api.congress.gov/v3/bill/117/hr/5293?format=json
608,22448,142,117,"{'actionDate': '2021-09-24', 'text': 'Became Public Law No: 117-41.'}",325,Senate,S,"A bill to amend the Alyce Spotted Bear and Walter Soboleff Commission on Native Children Act to extend the deadline for a report by the Alyce Spotted Bear and Walter Soboleff Commission on Native Children, and for other purposes.",S,2022-09-29,2022-09-29T03:41:41Z,https://api.congress.gov/v3/bill/117/s/325?format=json
609,22449,143,117,"{'actionDate': '2021-09-24', 'text': 'Became Public Law No: 117-40.'}",272,Senate,S,Congressional Budget Justification Transparency Act of 2021,S,2022-09-29,2022-09-29T03:41:39Z,https://api.congress.gov/v3/bill/117/s/272?format=json
610,22919,113,117,"{'actionDate': '2021-08-31', 'text': 'Became Public Law No: 117-39.'}",5085,House,H,Emergency Repatriation Assistance for Returning Americans Act,HR,2022-09-07,2022-09-07T13:36:16Z,https://api.congress.gov/v3/bill/117/hr/5085?format=json
611,22962,156,117,"{'actionDate': '2021-08-25', 'text': 'Became Public Law No: 117-38.'}",3642,House,H,Harlem Hellfighters Congressional Gold Medal Act,HR,2022-09-07,2022-09-07T13:39:31Z,https://api.congress.gov/v3/bill/117/hr/3642?format=json
612,22963,157,117,"{'actionDate': '2021-08-25', 'text': 'Became Public Law No: 117-37.'}",1448,House,H,PAWS for Veterans Therapy Act,HR,2022-09-29,2022-09-29T03:27:19Z,https://api.congress.gov/v3/bill/117/hr/1448?format=json
613,23213,157,117,"{'actionDate': '2021-08-06', 'text': 'Became Public Law No: 117-35.'}",772,House,H,"To designate the facility of the United States Postal Service located at 229 Minnetonka Avenue South in Wayzata, Minnesota, as the Jim Ramstad Post Office.",HR,2022-09-07,2022-09-07T13:36:14Z,https://api.congress.gov/v3/bill/117/hr/772?format=json
614,23214,158,117,"{'actionDate': '2021-08-06', 'text': 'Became Public Law No: 117-34.'}",264,House,H,"To designate the facility of the United States Postal Service located at 1101 Charlotte Street in Georgetown, South Carolina, as the ""Joseph Hayne Rainey Memorial Post Office Building"".",HR,2022-09-21,2022-09-21T15:06:19Z,https://api.congress.gov/v3/bill/117/hr/264?format=json
615,23215,159,117,"{'actionDate': '2021-08-06', 'text': 'Became Public Law No: 117-33.'}",208,House,H,"To designate the facility of the United States Postal Service located at 500 West Main Street, Suite 102 in Tupelo, Mississippi, as the Colonel Carlyle Smitty Harris Post Office.",HR,2022-09-07,2022-09-07T13:37:01Z,https://api.congress.gov/v3/bill/117/hr/208?format=json
616,23216,160,117,"{'actionDate': '2021-08-06', 'text': 'Became Public Law No: 117-36.'}",1002,House,H,DEBAR Act of 2021,HR,2022-09-07,2022-09-07T13:36:49Z,https://api.congress.gov/v3/bill/117/hr/1002?format=json
617,23244,188,117,"{'actionDate': '2021-08-05', 'text': 'Became Public Law No: 117-32.'}",3325,House,H,"To award four congressional gold medals to the United States Capitol Police and those who protected the U.S. Capitol on January 6, 2021.",HR,2022-09-07,2022-09-07T13:40:07Z,https://api.congress.gov/v3/bill/117/hr/3325?format=json
618,23423,117,117,"{'actionDate': '2021-07-30', 'text': 'Became Public Law No: 117-31.'}",3237,House,H,"Emergency Security Supplemental Appropriations Act, 2021",HR,2022-09-29,2022-09-29T03:27:27Z,https://api.congress.gov/v3/bill/117/hr/3237?format=json
619,23489,183,117,"{'actionDate': '2021-07-29', 'text': 'Became Public Law No: 117-29.'}",957,Senate,S,DUMP Opioids Act,S,2022-09-07,2022-09-07T13:36:46Z,https://api.congress.gov/v3/bill/117/s/957?format=json
620,23490,184,117,"{'actionDate': '2021-07-29', 'text': 'Became Public Law No: 117-30.'}",1910,Senate,S,Major Medical Facility Authorization Act of 2021,S,2022-09-29,2022-09-29T03:41:41Z,https://api.congress.gov/v3/bill/117/s/1910?format=json
621,23748,192,117,"{'actionDate': '2021-07-26', 'text': 'Became Public Law No: 117-28.'}",26,House,H,Construction Consensus Procurement Improvement Act of 2021,HR,2022-09-07,2022-09-07T13:39:08Z,https://api.congress.gov/v3/bill/117/hr/26?format=json
622,23800,244,117,"{'actionDate': '2021-07-22', 'text': 'Became Public Law No: 117-27.'}",1652,House,H,VOCA Fix to Sustain the Crime Victims Fund Act of 2021,HR,2022-09-07,2022-09-07T13:39:46Z,https://api.congress.gov/v3/bill/117/hr/1652?format=json
