24," <p>This bill authorizes the Office of the Inspector General of the Department of Health and Human Services to obtain information, assistance, and other support from federal agencies when investigating claims of information blocking by developers of, or entities offering, health information technologies.</p> <p><i>Information blocking</i> refers to a practice that is likely to interfere with, prevent, or materially discourage access, exchange, or use of electronic health information, such as the imposition of fees that make exchanging this information cost prohibitive.</p> </p>",," <p>This bill addresses health information technology provisions concerning cybersecurity practices and information blocking.</p> <p>The Department of Health and Human Services (HHS) may reduce fines and penalties for violations of certain federal privacy standards for health information if an entity subject to those standards has adopted particular cybersecurity practices.</p> <p>This bill also authorizes HHS's Office of the Inspector General to obtain information, assistance, and other support from federal agencies when investigating claims of information blocking by developers of, or entities offering, health information technologies.</p> <p><i>Information blocking</i> refers to a practice that is likely to interfere with, prevent, or materially discourage access, exchange, or use of electronic health information, such as the imposition of fees that make exchanging this information cost prohibitive.</p> </p>"," <p>This bill addresses health information technology provisions concerning cybersecurity practices and information blocking.</p> <p>The Department of Health and Human Services (HHS) may reduce fines and penalties for violations of certain federal privacy standards for health information if an entity subject to those standards has adopted particular cybersecurity practices.</p> <p>This bill also authorizes HHS's Office of the Inspector General to obtain information, assistance, and other support from federal agencies when investigating claims of information blocking by developers of, or entities offering, health information technologies.</p> <p><i>Information blocking</i> refers to a practice that is likely to interfere with, prevent, or materially discourage access, exchange, or use of electronic health information, such as the imposition of fees that make exchanging this information cost prohibitive.</p> </p>"," <p>This bill addresses health information technology provisions concerning cybersecurity practices and information blocking.</p> <p>The Department of Health and Human Services (HHS) may reduce fines and penalties for violations of certain federal privacy standards for health information if an entity subject to those standards has adopted particular cybersecurity practices.</p> <p>This bill also authorizes HHS's Office of the Inspector General to obtain information, assistance, and other support from federal agencies when investigating claims of information blocking by developers of, or entities offering, health information technologies.</p> <p><i>Information blocking</i> refers to a practice that is likely to interfere with, prevent, or materially discourage access, exchange, or use of electronic health information, such as the imposition of fees that make exchanging this information cost prohibitive.</p> </p>",7898,"To amend the Health Information Technology for Economic and Clinical Health Act to require the Secretary of Health and Human Services to consider certain recognized security practices of covered entities and business associates when making certain determinations, and for other purposes.",,,,,,
25,"Designates the facility of the United States Postal Service located at 3519 East Walnut Street in Pearland, Texas, as the ""Tom Reid Post Office Building.""",,,," <p>Designates the facility of the United States Postal Service located at 3519 East Walnut Street in Pearland, Texas, as the ""Tom Reid Post Office Building.""</p>",7810,"To designate the facility of the United States Postal Service located at 3519 East Walnut Street in Pearland, Texas, as the Tom Reid Post Office Building.",,,,,,
26,"Designates the facility of the United States Postal Service located at 101 South 16th Street in Clarinda, Iowa, as the ""Jessie Field Shambaugh Post Office Building.""",,,," <p>Designates the facility of the United States Postal Service located at 101 South 16th Street in Clarinda, Iowa, as the ""Jessie Field Shambaugh Post Office Building.""</p>",7502,"To designate the facility of the United States Postal Service located at 101 South 16th Street in Clarinda, Iowa, as the Jessie Field Shambaugh Post Office Building.",,,,,,
27," <p><b>Peace Corps Commemorative Work Extension Act</b></p> <p>This bill extends through January 24, 2028, the authority of the Peace Corps Commemorative Foundation to establish a commemorative work on federal land in the District of Columbia and its environs to commemorate the mission of the Peace Corps and the ideals on which the Peace Corps was founded.<br /> </p>",," <p><b>Peace Corps Commemorative Work Extension Act</b></p> <p>This bill extends through January 24, 2028, the authority of the Peace Corps Commemorative Foundation to establish a commemorative work on federal land in the District of Columbia and its environs to commemorate the mission of the Peace Corps and the ideals on which the Peace Corps was founded.<br /> </p>"," <p><b>Peace Corps Commemorative Work Extension Act</b></p> <p>This bill extends through January 24, 2028, the authority of the Peace Corps Commemorative Foundation to establish a commemorative work on federal land in the District of Columbia and its environs to commemorate the mission of the Peace Corps and the ideals on which the Peace Corps was founded.<br /> </p>"," <p><b>Peace Corps Commemorative Work Extension Act</b></p> <p>This bill extends through January 24, 2028, the authority of the Peace Corps Commemorative Foundation to establish a commemorative work on federal land in the District of Columbia and its environs to commemorate the mission of the Peace Corps and the ideals on which the Peace Corps was founded.<br /> </p>",7460,Peace Corps Commemorative Work Extension Act,,,,,,
28," <p>This bill designates the medical center of the Department of Veterans Affairs in Ann Arbor, Michigan, as the Lieutenant Colonel Charles S. Kettles Department of Veterans Affairs Medical Center or the Lieutenant Colonel Charles S. Kettles VA Medical Center.</p>",," <p>This bill designates the medical center of the Department of Veterans Affairs in Ann Arbor, Michigan, as the Lieutenant Colonel Charles S. Kettles Department of Veterans Affairs Medical Center or the Lieutenant Colonel Charles S. Kettles VA Medical Center.</p>"," <p>This bill designates the medical center of the Department of Veterans Affairs in Ann Arbor, Michigan, as the Lieutenant Colonel Charles S. Kettles Department of Veterans Affairs Medical Center or the Lieutenant Colonel Charles S. Kettles VA Medical Center.</p>"," <p>This bill designates the medical center of the Department of Veterans Affairs in Ann Arbor, Michigan, as the Lieutenant Colonel Charles S. Kettles Department of Veterans Affairs Medical Center or the Lieutenant Colonel Charles S. Kettles VA Medical Center.</p>",7347,"To designate the medical center of the Department of Veterans Affairs in Ann Arbor, Michigan, as the Lieutenant Colonel Charles S. Kettles Department of Veterans Affairs Medical Center.",,,,,,
29," <p><b>Patents for Humanity Program Improvement Act</b></p> <p>This bill authorizes the holder of an acceleration certificate awarded under the Patents for Humanity program to transfer the certificate to another party. </p> <p>(The Patents for Humanity program recognizes patent owners, applicants, and licensees that use their inventions to meet humanitarian challenges. The winners each receive a certificate which can be used to accelerate certain U.S. Patent and Trademark Office proceedings, such as a patent application.)</p> <p>",," <p><b>Patents for Humanity Program Improvement Act</b></p> <p>This bill authorizes the holder of an acceleration certificate awarded under the Patents for Humanity program to transfer the certificate to another party. </p> <p>(The Patents for Humanity program recognizes patent owners, applicants, and licensees that use their inventions to meet humanitarian challenges. The winners each receive a certificate which can be used to accelerate certain U.S. Patent and Trademark Office proceedings, such as a patent application.)</p> <p>"," <p><b>Patents for Humanity Program Improvement Act</b></p> <p>This bill authorizes the holder of an acceleration certificate awarded under the Patents for Humanity program to transfer the certificate to another party. </p> <p>(The Patents for Humanity program recognizes patent owners, applicants, and licensees that use their inventions to meet humanitarian challenges. The winners each receive a certificate that can be used to accelerate certain U.S. Patent and Trademark Office proceedings, such as a patent application.)</p> "," <p><b>Patents for Humanity Program Improvement Act</b></p> <p>This bill authorizes the holder of an acceleration certificate awarded under the Patents for Humanity program to transfer the certificate to another party. </p> <p>(The Patents for Humanity program recognizes patent owners, applicants, and licensees that use their inventions to meet humanitarian challenges. The winners each receive a certificate that can be used to accelerate certain U.S. Patent and Trademark Office proceedings, such as a patent application.)</p> ",7259,Patents for Humanity Program Improvement Act,,,,,,
