43, <div><b><br /></b></div> <div><b>Safeguarding Therapeutics Act</b></div> <p>This bill authorizes the Food and Drug Administration to destroy imported counterfeit medical devices.</p>,,,, <p><strong>Safeguarding Therapeutics Act</strong></p> <p>This bill authorizes the Food and Drug Administration to destroy imported counterfeit medical devices.</p>,5663,Safeguarding Therapeutics Act,,,,,,
44,"Designates the facility of the United States Postal Service located at 305 Northwest 5th Street in Oklahoma City, Oklahoma, as the ""Clara Luper Post Office Building.""",,,," <p>Designates the facility of the United States Postal Service located at 305 Northwest 5th Street in Oklahoma City, Oklahoma, as the ""Clara Luper Post Office Building.""</p>",5597,"To designate the facility of the United States Postal Service located at 305 Northwest 5th Street in Oklahoma City, Oklahoma, as the Clara Luper Post Office Building.",,,,,,
45, <p><b>Rocky Mountain National Park Ownership Correction Act</b> </p>  <p>This bill directs the Department of the Interior to convey specified federal land to the owner of specified nonfederal land if the owner of the nonfederal land offers to exchange the land.</p> <p>The values of the federal and nonfederal land to be exchanged shall be considered to be of equal value.</p> <p>The nonfederal land that is acquired by Interior shall be administered as part of Rocky Mountain National Park in Colorado. </p>, <p><b>Rocky Mountain National Park Ownership Correction Act</b> </p> <p>This bill directs the Department of the Interior to convey specified federal land to the owner of specified nonfederal land if the owner of the nonfederal land offers to exchange the land.</p> <p>The values of the federal and nonfederal land to be exchanged shall be considered to be of equal value.</p> <p>The nonfederal land that is acquired by Interior shall be administered as part of Rocky Mountain National Park in Colorado. </p>, <p><b>Rocky Mountain National Park Ownership Correction Act</b> </p> <p>This bill directs the Department of the Interior to convey specified federal land to the owner of specified nonfederal land if the owner of the nonfederal land offers to exchange the land.</p> <p>The values of the federal and nonfederal land to be exchanged shall be considered to be of equal value.</p> <p>The nonfederal land that is acquired by Interior shall be administered as part of Rocky Mountain National Park in Colorado. </p>, <p><b>Rocky Mountain National Park Ownership Correction Act</b> </p> <p>This bill directs the Department of the Interior to convey specified federal land to the owner of specified nonfederal land if the owner of the nonfederal land offers to exchange the land.</p> <p>The values of the federal and nonfederal land to be exchanged shall be considered to be of equal value.</p> <p>The nonfederal land that is acquired by Interior shall be administered as part of Rocky Mountain National Park in Colorado. </p>, <p><b>Rocky Mountain National Park Ownership Correction Act</b> </p> <p>This bill directs the Department of the Interior to convey specified federal land to the owner of specified nonfederal land if the owner of the nonfederal land offers to exchange the land.</p> <p>The values of the federal and nonfederal land to be exchanged shall be considered to be of equal value.</p> <p>The nonfederal land that is acquired by Interior shall be administered as part of Rocky Mountain National Park in Colorado. </p>,5459,Rocky Mountain National Park Ownership Correction Act,,,,,,
46," <p><b>Rocky Mountain National Park Boundary Modification Act</b></p> <p>This bill authorizes the Department of the Interior to acquire, by donation, approximately 40 acres of specified nonfederal land for inclusion in Rocky Mountain National Park in Colorado. Upon acquisition, Interior shall (1) modify the boundary of the park to include the acquisition, and (2) administer the acquired land as part of the park. </p>"," <p><b>Rocky Mountain National Park Boundary Modification Act</b></p> <p>This bill authorizes the Department of the Interior to acquire, by donation, approximately 40 acres of specified nonfederal land for inclusion in Rocky Mountain National Park in Colorado. Upon acquisition, Interior shall (1) modify the boundary of the park to include the acquisition, and (2) administer the acquired land as part of the park. </p>"," <p><b>Rocky Mountain National Park Boundary Modification Act</b></p> <p>This bill authorizes the Department of the Interior to acquire, by donation, approximately 40 acres of specified nonfederal land for inclusion in Rocky Mountain National Park in Colorado. Upon acquisition, Interior shall (1) modify the boundary of the park to include the acquisition, and (2) administer the acquired land as part of the park. </p>"," <p><b>Rocky Mountain National Park Boundary Modification Act</b></p> <p>This bill authorizes the Department of the Interior to acquire, by donation, approximately 40 acres of specified nonfederal land for inclusion in Rocky Mountain National Park in Colorado. Upon acquisition, Interior shall (1) modify the boundary of the park to include the acquisition, and (2) administer the acquired land as part of the park.</p>"," <p><b>Rocky Mountain National Park Boundary Modification Act</b></p> <p>This bill authorizes the Department of the Interior to acquire, by donation, approximately 40 acres of specified nonfederal land for inclusion in Rocky Mountain National Park in Colorado. Upon acquisition, Interior shall (1) modify the boundary of the park to include the acquisition, and (2) administer the acquired land as part of the park.</p>",5458,Rocky Mountain National Park Boundary Modification Act,,,,,,
47,"Designates the facility of the United States Postal Service located at 599 East Genesse Street in Fayetteville, New York, as the ""George H. Bacel Post Office Building.""",,,," <p>Designates the facility of the United States Postal Service located at 599 East Genesse [<i>sic</i>] Street in Fayetteville, New York, as the ""George H. Bacel Post Office Building.""</p>",5451,"To designate the facility of the United States Postal Service located at 599 East Genesse Street in Fayetteville, New York, as the George H. Bacel Post Office Building.",,,,,,
48," <p><b>Securing America's Ports Act</b></p> <p>This bill requires the Department of Homeland Security (DHS) to report to Congress a plan to scan all commercial and passenger vehicles entering the United States at a land port of entry using large-scale non-intrusive inspection systems, such as X-ray and gamma-ray imaging systems. The plan shall include elements such as (1) an inventory of such systems currently in use, (2) the estimated costs of achieving a 100% scanning rate, and (3) the anticipated impact that increasing the scanning rate will have on wait times at land ports of entry. DHS shall periodically report to Congress on the progress in implementing the plan.</p> <p>DHS shall also carry out a pilot program to research and develop technology enhancements to inspection areas at land ports of entry. </p>"," <p><b>Securing America's Ports Act</b></p> <p>This bill requires the Department of Homeland Security (DHS) to report to Congress a plan to expeditiously scan all commercial and passenger vehicles entering the United States at a land port of entry using large-scale non-intrusive inspection systems, such as X-ray and gamma-ray imaging systems, or similar technology. The plan shall include elements such as (1) an inventory of such systems currently in use, (2) the estimated costs of achieving a 100% scanning rate, and (3) the anticipated impact that increasing the scanning rate will have on wait times at land ports of entry. DHS shall periodically report to Congress on the progress in implementing the plan.</p> <p>DHS shall also research and develop technology enhancements to inspection areas at land ports of entry. </p>"," <p><b>Securing America's Ports Act</b></p> <p>This bill requires the Department of Homeland Security (DHS) to report to Congress a plan to expeditiously scan all commercial and passenger vehicles entering the United States at a land port of entry using large-scale non-intrusive inspection systems, such as X-ray and gamma-ray imaging systems, or similar technology. The plan shall include elements such as (1) an inventory of such systems currently in use, (2) the estimated costs of achieving a 100% scanning rate, and (3) the anticipated impact that increasing the scanning rate will have on wait times at land ports of entry. DHS shall periodically report to Congress on the progress in implementing the plan.</p> <p>DHS shall also research and develop technology enhancements to inspection areas at land ports of entry. </p>"," <p><b>Securing America's Ports Act</b></p>  <p>This bill requires the Department of Homeland Security (DHS) to report to Congress a plan to perform high-throughput scanning of all commercial and passenger vehicles and freight rail traffic entering the United States at a land port of entry or rail-border crossing using large-scale non-intrusive inspection systems, such as X-ray and gamma-ray imaging systems, or similar technology. The plan shall include elements such as (1) an inventory of such systems currently in use, (2) the estimated costs of achieving a 100% scanning rate, and (3) the anticipated impact that increasing the scanning rate will have on wait times at land ports of entry and rail-border crossings. DHS shall periodically report to Congress on the progress in implementing the plan.</p>"," <p><b>Securing America's Ports Act</b></p> <p>This bill requires the Department of Homeland Security (DHS) to report to Congress a plan to perform high-throughput scanning of all commercial and passenger vehicles and freight rail traffic entering the United States at a land port of entry or rail-border crossing using large-scale non-intrusive inspection systems, such as X-ray and gamma-ray imaging systems, or similar technology. The plan shall include elements such as (1) an inventory of such systems currently in use, (2) the estimated costs of achieving a 100% scanning rate, and (3) the anticipated impact that increasing the scanning rate will have on wait times at land ports of entry and rail-border crossings. DHS shall periodically report to Congress on the progress in implementing the plan.</p>",5273,Securing America's Ports Act,," <p><b>Securing America's Ports Act</b></p>  <p>This bill requires the Department of Homeland Security (DHS) to report to Congress a plan to perform high-throughput scanning of all commercial and passenger vehicles and freight rail traffic entering the United States at a land port of entry or rail-border crossing using large-scale non-intrusive inspection systems, such as X-ray and gamma-ray imaging systems, or similar technology. The plan shall include elements such as (1) an inventory of such systems currently in use, (2) the estimated costs of achieving a 100% scanning rate, and (3) the anticipated impact that increasing the scanning rate will have on wait times at land ports of entry and rail-border crossings. DHS shall periodically report to Congress on the progress in implementing the plan.</p>"," <p><b>Securing America's Ports Act</b></p> <p>This bill requires the Department of Homeland Security (DHS) to report to Congress a plan to perform high-throughput scanning of all commercial and passenger vehicles and freight rail traffic entering the United States at a land port of entry or rail-border crossing using large-scale non-intrusive inspection systems, such as X-ray and gamma-ray imaging systems, or similar technology. The plan shall include elements such as (1) an inventory of such systems currently in use, (2) the estimated costs of achieving a 100% scanning rate, and (3) the anticipated impact that increasing the scanning rate will have on wait times at land ports of entry and rail-border crossings. DHS shall periodically report to Congress on the progress in implementing the plan.</p>",,,
49,"Designates the facility of the United States Postal Service located at 476 East Main Street in Galesburg, Illinois, as the ""Senior Airman Daniel Miller Post Office Building.""",,,," <p>Designates the facility of the United States Postal Service located at 476 East Main Street in Galesburg, Illinois, as the ""Senior Airman Daniel Miller Post Office Building.""</p>",5123,"To designate the facility of the United States Postal Service located at 476 East Main Street in Galesburg, Illinois, as the Senior Airman Daniel Miller Post Office Building.",,,,,,
50," <p>This bill designates the community-based outpatient clinic of the Department of Veterans Affairs in Youngstown, Ohio, as the &quot;Carl Nunziato VA Clinic.&quot;</p>",," <p>This bill designates the community-based outpatient clinic of the Department of Veterans Affairs in Youngstown, Ohio, as the Carl Nunziato VA Clinic.</p>"," <p>This bill designates the community-based outpatient clinic of the Department of Veterans Affairs in Youngstown, Ohio, as the Carl Nunziato VA Clinic.</p>"," <p>This bill designates the community-based outpatient clinic of the Department of Veterans Affairs in Youngstown, Ohio, as the Carl Nunziato VA Clinic.</p>",5023,"To name the Department of Veterans Affairs community-based outpatient clinic in Youngstown, Ohio, as the Carl Nunziato VA Clinic.",,,,,,
51,"Designates the facility of the United States Postal Service located at 14 Walnut Street in Bordentown, New Jersey, as the ""Clara Barton Post Office Building.""",,,," <p>Designates the facility of the United States Postal Service located at 14 Walnut Street in Bordentown, New Jersey, as the ""Clara Barton Post Office Building.""</p>",4988,"To designate the facility of the United States Postal Service located at 14 Walnut Street in Bordentown, New Jersey, as the Clara Barton Post Office Building.",,,,,,
52," <p>This bill designates the community-based outpatient clinic of the Department of Veterans Affairs located at 3285 South Val Vista Drive, Gilbert, Arizona, as the Staff Sergeant Alexander W. Conrad Veterans Affairs Health Care Clinic.</p>",," <p>This bill designates the community-based outpatient clinic of the Department of Veterans Affairs located at 3285 South Val Vista Drive, Gilbert, Arizona, as the Staff Sergeant Alexander W. Conrad Veterans Affairs Health Care Clinic.</p>"," <p>This bill designates the community-based outpatient clinic of the Department of Veterans Affairs located at 3285 South Val Vista Drive, Gilbert, Arizona, as the Staff Sergeant Alexander W. Conrad Veterans Affairs Health Care Clinic.</p>"," <p>This bill designates the community-based outpatient clinic of the Department of Veterans Affairs located at 3285 South Val Vista Drive, Gilbert, Arizona, as the Staff Sergeant Alexander W. Conrad Veterans Affairs Health Care Clinic.</p>",4983,"To designate the Department of Veterans Affairs community-based outpatient clinic in Gilbert, Arizona, as the Staff Sergeant Alexander W. Conrad Veterans Affairs Health Care Clinic.",,,,,,
53," <p><b>Protecting Families of Fallen Servicemembers Act</b></p> <p>This bill revises the conditions allowing a service member to terminate a commercial mobile, telephone exchange, Internet access, or multichannel video programming service contract at any time after the date the service member receives military orders to relocate for at least 90 days to a location that does not support such contract. It treats as individuals covered, and therefore allowed to terminate such a contract (1) a spouse or dependent of a service member who dies while in military service or a member of the reserve components performing full-time or active reserve duty or inactive-duty training; (2) a spouse or dependent of a service member who incurs a catastrophic injury or illness, if the member incurs the injury or illness while performing such duty; and (3) a member of the reserve components performing such duty.</p>",," <p><b>Protecting Families of Fallen Servicemembers Act</b></p> <p>This bill revises the conditions allowing a service member to terminate a commercial mobile, telephone exchange, Internet access, or multichannel video programming service contract at any time after the date the service member receives military orders to relocate for at least 90 days to a location that does not support such contract. It treats as individuals covered, and therefore allowed to terminate such a contract (1) a spouse or dependent of a service member who dies while in military service or a member of the reserve components performing full-time or active reserve duty or inactive-duty training; (2) a spouse or dependent of a service member who incurs a catastrophic injury or illness, if the member incurs the injury or illness while in military service or performing such duty; and (3) a member of the reserve components performing such duty.</p>"," <p><b>Protecting Families of Fallen Servicemembers Act</b></p> <p>This bill revises the conditions allowing a service member to terminate a commercial mobile, telephone exchange, internet access, or multichannel video programming service contract at any time after the date the service member receives military orders to relocate for at least 90 days to a location that does not support such contract. It treats as individuals covered, and therefore allowed to terminate such a contract (1) a spouse or dependent of a service member who dies while in military service or a member of the reserve components performing full-time or active reserve duty or inactive-duty training; (2) a spouse or dependent of a service member who incurs a catastrophic injury or illness, if the member incurs the injury or illness while in military service or performing such duty; and (3) a member of the reserve components performing such duty.</p>"," <p><b>Protecting Families of Fallen Servicemembers Act</b></p> <p>This bill revises the conditions allowing a service member to terminate a commercial mobile, telephone exchange, internet access, or multichannel video programming service contract at any time after the date the service member receives military orders to relocate for at least 90 days to a location that does not support such contract. It treats as individuals covered, and therefore allowed to terminate such a contract (1) a spouse or dependent of a service member who dies while in military service or a member of the reserve components performing full-time or active reserve duty or inactive-duty training; (2) a spouse or dependent of a service member who incurs a catastrophic injury or illness, if the member incurs the injury or illness while in military service or performing such duty; and (3) a member of the reserve components performing such duty.</p>",4356,Protecting Families of Fallen Servicemembers Act,,,,,,
54, <p><strong>Great Lakes Restoration Initiative Act of 2019 or the GLRI Act of 2019</strong></p> <p>This bill reauthorizes through FY2026 the Great Lakes Restoration Initiative.</p>, <p><strong>Great Lakes Restoration Initiative Act of 2019 or the GLRI Act of 2019</strong></p> <p>This bill reauthorizes through FY2026 the Great Lakes Restoration Initiative.</p>, <p><strong>Great Lakes Restoration Initiative Act of 2019 or the GLRI Act of 2019</strong></p> <p>This bill reauthorizes through FY2026 the Great Lakes Restoration Initiative.</p>, <p><strong>Great Lakes Restoration Initiative Act of 2019 or the GLRI Act of 2019</strong></p> <p>This bill reauthorizes through FY2026 the Great Lakes Restoration Initiative.</p>, <p><strong>Great Lakes Restoration Initiative Act of 2019 or the GLRI Act of 2019</strong></p> <p>This bill reauthorizes through FY2026 the Great Lakes Restoration Initiative.</p>,4031,GLRI Act of 2019,,,,,,
55,"Designates the facility of the United States Postal Service located at 12711 East Jefferson Avenue in Detroit, Michigan, as the ""Aretha Franklin Post Office Building.""",,,," <p>Designates the facility of the United States Postal Service located at 12711 East Jefferson Avenue in Detroit, Michigan, as the ""Aretha Franklin Post Office Building.""</p>",3976,"To designate the facility of the United States Postal Service located at 12711 East Jefferson Avenue in Detroit, Michigan, as the Aretha Franklin Post Office Building.",,,,,,
56, <p><b>School-Based Allergies and Asthma Management Program Act</b></p> <p>This bill preferences for grants under the children's asthma treatment program states that require schools to establish allergy and asthma management programs that include individual action plans for students diagnosed with allergies or asthma.</p>, <p><b>School-Based Allergies and Asthma Management Program Act</b></p> <p>This bill establishes preferences for grants under the children's asthma treatment program for states that require schools to establish allergy and asthma management programs that include individual action plans for students diagnosed with allergies or asthma.</p>, <p><b>School-Based Allergies and Asthma Management Program Act</b></p> <p>This bill establishes preferences for grants under the children's asthma treatment program for states that require schools to establish allergy and asthma management programs that include individual action plans for students diagnosed with allergies or asthma.</p>, <p><b>School-Based Allergies and Asthma Management Program Act</b></p> <p>This bill establishes preferences for grants under the children's asthma treatment program for states that require schools to establish allergy and asthma management programs that include individual action plans for students diagnosed with allergies or asthma.</p>, <p><b>School-Based Allergies and Asthma Management Program Act</b></p> <p>This bill establishes preferences for grants under the children's asthma treatment program for states that require schools to establish allergy and asthma management programs that include individual action plans for students diagnosed with allergies or asthma.</p>,2468,School-Based Allergies and Asthma Management Program Act,,,,,,
57, <p><b>Henrietta Lacks Enhancing Cancer Research Act of 2019</b></p> <p>This bill requires the Government Accountability Office to complete a study reviewing how federal agencies address barriers to participation in federally-funded cancer clinical trials by individuals from underrepresented populations and provide recommendations for addressing such barriers. </p>,, <p><b>Henrietta Lacks Enhancing Cancer Research Act of 2019</b></p> <p>This bill requires the Government Accountability Office to complete a study reviewing how federal agencies address barriers to participation in federally-funded cancer clinical trials by individuals from underrepresented populations and provide recommendations for addressing such barriers. </p>, <p><b>Henrietta Lacks Enhancing Cancer Research Act of 2019</b></p> <p>This bill requires the Government Accountability Office to complete a study reviewing how federal agencies address barriers to participation in federally-funded cancer clinical trials by individuals from underrepresented populations and provide recommendations for addressing such barriers. </p>, <p><b>Henrietta Lacks Enhancing Cancer Research Act of 2019</b></p> <p>This bill requires the Government Accountability Office to complete a study reviewing how federal agencies address barriers to participation in federally-funded cancer clinical trials by individuals from underrepresented populations and provide recommendations for addressing such barriers. </p>,1966,Henrietta Lacks Enhancing Cancer Research Act of 2019,,,,,,
58," <p><b>Orange Book Transparency Act of 2019</b></p> <p>This bill modifies requirements for the Food and Drug Administration (FDA)	to list and publish drug patent and exclusivity information. Specifically, the FDA must include on its list certain patent information and must specify each drug exclusivity period that has not concluded. </p> <p>The holder of an approved drug application must notify the FDA when a listed patent is invalidated by a court or by the Patent Trial and Appeal Board. The FDA must remove invalidated patents from its list, subject to the 180-day drug exclusivity period.</p>",,,," <p><strong>Orange Book Transparency Act of 2020</strong></p>This bill modifies requirements for the Food and Drug Administration (FDA)	to list and publish drug patent and exclusivity information. Specifically, the FDA must include on its list certain patent information and must specify each drug exclusivity period that has not concluded. <p>The holder of an approved drug application must notify the FDA when a listed patent is invalidated by a court or by the Patent Trial and Appeal Board. The FDA must remove invalidated patents from its list, subject to the 180-day drug exclusivity period.</p>",1503,Orange Book Transparency Act of 2020,,,,,,
