63,,," <p><b>Driftnet Modernization and Bycatch Reduction Act</b></p> <p>This bill addresses certain driftnet fishing. (Driftnet fishing is a method of fishing in which a gillnet composed of a panel or panels of webbing, or a series of such gillnets, is placed in the water and allowed to drift with the currents and winds for the purpose of entangling fish in the webbing.)	</p> <p>Currently, the use of large-scale drift gillnets with a total length of 2.5 kilometers or more is prohibited in the United States.	The bill expands the definition of large-scale driftnet fishing to prohibit the use of gillnets with a mesh size of 14 inches or greater. This expanded prohibition does not apply within the U.S. exclusive economic zone for five years.</p> <p>The Department of Commerce must conduct a transition program to facilitate the phase out of large-scale driftnet fishing and to promote the adoption of alternative fishing practices that minimize the incidental catch of living marine resources. </p> <p>Commerce must award grants to program participants.</p> <p>The North Pacific Fishery Management Council may recommend and Commerce may approve regulations that require charter operators to pay fees on vessels that harvest Pacific halibut in specific International Pacific Halibut Commission regulatory areas.</p>"," <p><b>Driftnet Modernization and Bycatch Reduction Act</b></p> <p>This bill addresses certain driftnet fishing. (Driftnet fishing is a method of fishing in which a gillnet composed of a panel or panels of webbing, or a series of such gillnets, is placed in the water and allowed to drift with the currents and winds for the purpose of entangling fish in the webbing.)	</p> <p>Currently, the use of large-scale drift gillnets with a total length of 2.5 kilometers or more is prohibited in the United States.	The bill expands the definition of large-scale driftnet fishing to prohibit the use of gillnets with a mesh size of 14 inches or greater. This expanded prohibition does not apply within the U.S. exclusive economic zone for five years.</p> <p>The Department of Commerce must conduct a transition program to facilitate the phase out of large-scale driftnet fishing and to promote the adoption of alternative fishing practices that minimize the incidental catch of living marine resources. </p> <p>Commerce must award grants to program participants.</p> <p>The North Pacific Fishery Management Council may recommend and Commerce may approve regulations that require charter operators to pay fees on vessels that harvest Pacific halibut in specific International Pacific Halibut Commission regulatory areas.</p>",,906,Driftnet Modernization and Bycatch Reduction Act," <p><b>Driftnet Modernization and Bycatch Reduction Act</b></p> <p>This bill addresses certain driftnet fishing. (Driftnet fishing is a method of fishing in which a gillnet composed of a panel or panels of webbing, or a series of such gillnets, is placed in the water and allowed to drift with the currents and winds for the purpose of entangling fish in the webbing.)	</p> <p>Currently, the use of large-scale drift gillnets with a total length of 2.5 kilometers or more is prohibited in the United States.	The bill expands the definition of large-scale driftnet fishing to prohibit the use of gillnets with a mesh size of 14 inches or greater. This expanded prohibition does not apply within the U.S. exclusive economic zone for five years.</p> <p>The Department of Commerce must conduct a transition program to facilitate the phase out of large-scale driftnet fishing and to promote the adoption of alternative fishing practices that minimize the incidental catch of living marine resources. </p> <p>Commerce must award grants to program participants.</p>",," <p><b>Driftnet Modernization and Bycatch Reduction Act</b></p> <p>This bill addresses certain driftnet fishing. (Driftnet fishing is a method of fishing in which a gillnet composed of a panel or panels of webbing, or a series of such gillnets, is placed in the water and allowed to drift with the currents and winds for the purpose of entangling fish in the webbing.)	</p> <p>Currently, the use of large-scale drift gillnets with a total length of 2.5 kilometers or more is prohibited in the United States.	The bill expands the definition of large-scale driftnet fishing to prohibit the use of gillnets with a mesh size of 14 inches or greater. This expanded prohibition does not apply within the U.S. exclusive economic zone for five years.</p> <p>The Department of Commerce must conduct a transition program to facilitate the phase out of large-scale driftnet fishing and to promote the adoption of alternative fishing practices that minimize the incidental catch of living marine resources. </p> <p>Commerce must award grants to program participants.</p> <p>The North Pacific Fishery Management Council may recommend and Commerce may approve regulations that require charter operators to pay fees on vessels that harvest Pacific halibut.</p>",,,
64,,,," <p>This resolution condemns abuses committed by state security forces and armed groups in the northwest and southwest regions of Cameroon, and it affirms that the United States continues to hold Cameroon responsible for safeguarding the security and constitutional rights of all of its citizens, regardless of their region, religion, or political views. Further, it urges all parties to the conflict in Cameroon, the government of Cameroon, U.S. foreign relations entities, and members of the international community to take specified steps toward resolving the ongoing civil conflict in Cameroon.</p>",,684,"A resolution calling on the Government of Cameroon and separatist armed groups from the English-speaking Northwest and Southwest regions to end all violence, respect the human rights of all Cameroonians, and pursue a genuinely inclusive dialogue toward resolving the ongoing civil conflict in Anglophone Cameroon."," <p>This resolution condemns abuses committed by state security forces and armed groups in the northwest and southwest regions of Cameroon, and it affirms that the United States continues to hold Cameroon responsible for safeguarding the security and constitutional rights of all of its citizens, regardless of their region, religion, or political views. Further, it urges all parties to the conflict in Cameroon, the government of Cameroon, U.S. foreign relations entities, and members of the international community to take specified steps toward resolving the ongoing civil conflict in Cameroon.</p>",,,,,
65,,,," <p>This resolution </p> <ul> <li>reaffirms support for elevated collaboration between the United States and the Association of South East Asian Nations (ASEAN), particularly in terms of economic cooperation and human rights; </li> <li>urges ASEAN to foster multilateral relations with non-ASEAN partners; </li> <li>expresses support for ASEAN nations in addressing maritime and territorial disputes, as well as corruption in the public and private sectors; </li> <li>calls on ASEAN nations to ensure human rights, a protected marine environment, and safe access to international waterways in the Asia-Pacific; </li> <li>urges ASEAN nations to uphold international agreements with respect to North Korea's missile programs; and </li> <li>expresses support for the Lower Mekong Initiative, a partnership between the United States, Cambodia, Laos, Burma (Myanmar), Thailand, and Vietnam to promote sustainability and economic development in the region. </li></ul>",,406,"A resolution recognizing that for 50 years, the Association of South East Asian Nations (ASEAN) and its ten members, Brunei, Cambodia, Indonesia, Laos, Malaysia, Myanmar, the Philippines, Singapore, Thailand, and Vietnam, have worked with the United States toward stability, prosperity, and peace in Southeast Asia, and expressing the sense of the Senate that the United States will continue to remain a strong, reliable, and active partner in the ASEAN region."," <p>This resolution </p> <ul> <li>reaffirms support for elevated collaboration between the United States and the Association of South East Asian Nations (ASEAN), particularly in terms of economic cooperation and human rights; </li> <li>urges ASEAN to foster multilateral relations with non-ASEAN partners; </li> <li>expresses support for ASEAN nations in addressing maritime and territorial disputes, as well as corruption in the public and private sectors; </li> <li>calls on ASEAN nations to ensure human rights, a protected marine environment, and safe access to international waterways in the Asia-Pacific; </li> <li>urges ASEAN nations to uphold international agreements with respect to North Korea's missile programs; and </li> <li>expresses support for the Lower Mekong Initiative, a partnership between the United States, Cambodia, Laos, Burma (Myanmar), Thailand, and Vietnam to promote sustainability and economic development in the region. </li></ul>",," <p>This resolution </p> <ul type=""disc""> <li>reaffirms support for elevated collaboration between the United States and the Association of South East Asian Nations (ASEAN), particularly in terms of economic cooperation and human rights; </li> <li>encourages cooperation between the United States and the nations of ASEAN as they respond to COVID-19 (i.e., coronavirus disease 2019) and future public health challenges;</li> <li>urges ASEAN to foster multilateral relations with non-ASEAN partners; </li> <li>expresses support for ASEAN nations in addressing maritime and territorial disputes, as well as corruption in the public and private sectors; </li> <li>calls on ASEAN nations to ensure human rights, a protected marine environment, and safe access to international waterways in the Indo-Pacific; </li> <li>applauds ASEAN nations that have upheld international agreements with respect to North Korea's missile programs; and </li> <li>expresses support for the Lower Mekong Initiative, a partnership between the United States, Cambodia, Laos, Burma (Myanmar), Thailand, and Vietnam to promote sustainability and economic development in the region. </li> </ul> <div> <div> </div> </div>",,,
66,,,,,,82,A joint resolution relating to the disapproval of the proposed export to the Government of the Kingdom of Saudi Arabia of certain defense articles.," <p>This joint resolution prohibits the issuance of an export license with respect to a specified proposed export of certain defense articles, including defense services and technical data, to Saudi Arabia.</p>",,,,,
67,,,,,,3985,"A bill to improve and reform policing practices, accountability, and transparency."," <p><strong>Just and Unifying Solutions To Invigorate Communities Everywhere Act of 2020 or the JUSTICE Act</strong></p> <p>This bill addresses policies and issues regarding policing practices and law enforcement accountability. The bill funds state and local grants, incentivizes state and local reporting on the use of certain policing practices, creates new federal offenses for certain misconduct, establishes a commission to study the conditions affecting Black men and boys, and establishes best practices and training requirements.",,,,,
68,,," <p><b>Federal Advance Contracts Enhancement Act or the FACE Act</b></p> <p>This bill directs the Federal Emergency Management Agency (FEMA) to report to Congress on advance contracts. <i>Advance contracts</i> are established prior to disasters to provide life-sustaining goods and services in the immediate aftermath of a disaster.</p> <p> The report must include (1) information required in the initial report on recurring disaster response requirements; and (2) an updated strategy that defines the objectives of advance contracts, how such contracts contribute to FEMA disaster response operations, how to maximize the award of advance contracts to small business concerns, and whether and how such contracts should be prioritized in relation to new post-disaster contract awards.</p> <p>The bill sets forth additional duties of FEMA with respect to advance contracts, including requiring FEMA to (1) update and implement guidance for its program office and acquisition personnel to identify acquisition planning time frames and considerations across the entire acquisition planning process, and (2) communicate the purpose and use of a master acquisition planning schedule.</p>"," <p><b>Federal Advance Contracts Enhancement Act or the FACE Act</b></p> <p>This bill directs the Federal Emergency Management Agency (FEMA) to report to Congress on advance contracts. <i>Advance contracts</i> are established prior to disasters to provide life-sustaining goods and services in the immediate aftermath of a disaster.</p> <p>The report must include (1) information required in the initial report on recurring disaster response requirements; and (2) an updated strategy that defines the objectives of advance contracts, how such contracts contribute to FEMA disaster response operations, how to maximize the award of advance contracts to small business concerns, and whether and how such contracts should be prioritized in relation to new post-disaster contract awards.</p> <p>The bill sets forth additional duties of FEMA with respect to advance contracts, including requiring FEMA to (1) update and implement guidance for its program office and acquisition personnel to identify acquisition planning time frames and considerations across the entire acquisition planning process, and (2) communicate the purpose and use of a master acquisition planning schedule.</p>"," <p><b>Federal Advance Contracts Enhancement Act or the FACE Act</b></p> <p>This bill directs the Federal Emergency Management Agency (FEMA) to report to Congress on advance contracts. <i>Advance contracts</i> are established prior to disasters to provide life-sustaining goods and services in the immediate aftermath of a disaster.</p> <p> The report must include (1) information required in the initial report on recurring disaster response requirements; and (2) an updated strategy that defines the objectives of advance contracts, how such contracts contribute to FEMA disaster response operations, how to maximize the award of advance contracts to small business concerns, and whether and how such contracts should be prioritized in relation to new post-disaster contract awards.</p> <p>The bill sets forth additional duties of FEMA with respect to advance contracts, including requiring FEMA to (1) update and implement guidance for its program office and acquisition personnel to identify acquisition planning time frames and considerations across the entire acquisition planning process, and (2) communicate the purpose and use of a master acquisition planning schedule.</p>",979,FACE Act," <p><b>Federal Advance Contracts Enhancement Act or the FACE Act</b></p> <p>This bill directs the Federal Emergency Management Agency (FEMA) to report to Congress on advance contracts. Advance contracts are established prior to disasters to provide life-sustaining goods and services in the immediate aftermath of a disaster. The report must include (1) information required in the initial report on recurring disaster response requirements; and (2) an updated strategy that defines the objectives of advance contracts, how such contracts contribute to FEMA disaster response operations, and whether and how such contracts should be prioritized in relation to new post-disaster contract awards.</p> <p>The bill sets forth additional duties of FEMA with respect to advance contracts, including requiring FEMA to (1) update and implement guidance for its program office and acquisition personnel to identify acquisition planning time frames and considerations across the entire acquisition planning process, and (2) communicate the purpose and use of a master acquisition planning schedule.</p>",," <p><b>Federal Advance Contracts Enhancement Act or the FACE Act</b></p> <p>This bill directs the Federal Emergency Management Agency (FEMA) to report to Congress on advance contracts. <i>Advance contracts</i> are established prior to disasters to provide life-sustaining goods and services in the immediate aftermath of a disaster.</p> <p> The report must include (1) information required in the initial report on recurring disaster response requirements; and (2) an updated strategy that defines the objectives of advance contracts, how such contracts contribute to FEMA disaster response operations, how to maximuze the award of advance contracts to small business concerns, and whether and how such contracts should be prioritized in relation to new post-disaster contract awards.</p> <p>The bill sets forth additional duties of FEMA with respect to advance contracts, including requiring FEMA to (1) update and implement guidance for its program office and acquisition personnel to identify acquisition planning time frames and considerations across the entire acquisition planning process, and (2) communicate the purpose and use of a master acquisition planning schedule.</p>",,,
69,,," <p><b>Coordinated Ocean Observations and Research Act of 2020</b></p> <p>This bill reauthorizes through FY2025 and revises the Integrated Coastal and Ocean Observation System (IOOS), which is a network of federal and regional entities that provide information about the nation's coasts, oceans, and Great Lakes, as well as new tools and forecasts to improve safety, enhance the economy, and protect the environment.</p> <p>The bill revises the authority of the National Oceanic and Atmospheric Administration (NOAA) to conduct scientific assessments related to storms, including to (1) direct NOAA to seek public input before the Named Storm Event Model (the official meteorological and oceanographic computerized model which utilizes data to replicate the magnitude, timing, and spatial variations of winds, rainfall, and storm surges associated with named storms for which post-storm assessments are conducted) takes effect, and (2) allow NOAA to deploy sensors to areas in coastal states that are at the highest risk of experiencing geophysical events that would cause indeterminate losses.</p> <p>The bill provides statutory authority for NOAA's National Water Center. (The center currently exists at NOAA as the research and operational center of excellence for hydrologic analyses, forecasting, and related decision support services.)</p> <p>Additionally, the bill directs the National Weather Service (NWS) to make a policy directive for the National Water Center publicly available. The NWS must also (1) initiate and lead all research and development activities to develop operational water resource prediction and related decision support products, (2) collaborate with relevant state and federal agencies regarding total water prediction, and (3) collaboratively develop capabilities necessary for total water predictive capacity.</p> </p>"," <p><b>Coordinated Ocean Observations and Research Act of 2020</b></p> <p>This bill reauthorizes through FY2025 and revises the Integrated Coastal and Ocean Observation System (IOOS), which is a network of federal and regional entities that provide information about the nation's coasts, oceans, and Great Lakes, as well as new tools and forecasts to improve safety, enhance the economy, and protect the environment.</p> <p>The bill revises the authority of the National Oceanic and Atmospheric Administration (NOAA) to conduct scientific assessments related to storms, including to (1) direct NOAA to seek public input before the Named Storm Event Model (the official meteorological and oceanographic computerized model which utilizes data to replicate the magnitude, timing, and spatial variations of winds, rainfall, and storm surges associated with named storms for which post-storm assessments are conducted) takes effect, and (2) allow NOAA to deploy sensors to areas in coastal states that are at the highest risk of experiencing geophysical events that would cause indeterminate losses.</p> <p>The bill provides statutory authority for NOAA's National Water Center. (The center currently exists at NOAA as the research and operational center of excellence for hydrologic analyses, forecasting, and related decision support services.)</p> <p>Additionally, the bill directs the National Weather Service (NWS) to make a policy directive for the National Water Center publicly available. The NWS must also (1) initiate and lead all research and development activities to develop operational water resource prediction and related decision support products, (2) collaborate with relevant state and federal agencies regarding total water prediction, and (3) collaboratively develop capabilities necessary for total water predictive capacity.</p> </p>"," <p><b>Coordinated Ocean Observations and Research Act of 2020</b></p> <p>This bill reauthorizes through FY2025 and revises the Integrated Coastal and Ocean Observation System (IOOS), which is a network of federal and regional entities that provide information about the nation's coasts, oceans, and Great Lakes, as well as new tools and forecasts to improve safety, enhance the economy, and protect the environment.</p> <p>The bill revises the authority of the National Oceanic and Atmospheric Administration (NOAA) to conduct scientific assessments related to storms, including to (1) direct NOAA to seek public input before the Named Storm Event Model (the official meteorological and oceanographic computerized model which utilizes data to replicate the magnitude, timing, and spatial variations of winds, rainfall, and storm surges associated with named storms for which post-storm assessments are conducted) takes effect, and (2) allow NOAA to deploy sensors to areas in coastal states that are at the highest risk of experiencing geophysical events that would cause indeterminate losses.</p> <p>The bill provides statutory authority for NOAA's National Water Center. (The center currently exists at NOAA as the research and operational center of excellence for hydrologic analyses, forecasting, and related decision support services.)</p> <p>Additionally, the bill directs the National Weather Service (NWS) to make a policy directive for the National Water Center publicly available. The NWS must also (1) initiate and lead all research and development activities to develop operational water resource prediction and related decision support products, (2) collaborate with relevant state and federal agencies regarding total water prediction, and (3) collaboratively develop capabilities necessary for total water predictive capacity.</p> </p>",914,Coordinated Ocean Observations and Research Act of 2020," <p><b>Coordinated Ocean Observations and Research Act of 2019</b></p> <p>This bill reauthorizes through FY2024 and revises the Integrated Coastal and Ocean Observation System (IOOS), which is a network of federal and regional entities that provide information about the nation's coasts, oceans, and Great Lakes, as well as new tools and forecasts to improve safety, enhance the economy, and protect the environment.</p>  <p>The bill revises the authority of the National Oceanic and Atmospheric Administration (NOAA) to conduct scientific assessments related to storms, including to (1) direct NOAA to seek public input before the Named Storm Event Model (the official meteorological and oceanographic computerized model which utilizes data to replicate the magnitude, timing, and spatial variations of winds, rainfall, and storm surges associated with named storms for which post-storm assessments are conducted) takes effect, and (2) allow NOAA to deploy sensors to areas in coastal states that are at the highest risk of experiencing geophysical events that would cause indeterminate losses.</p> <p>The bill provides statutory authority for NOAA's National Water Center. (The center currently exists at NOAA as the research and operational center of excellence for hydrologic analyses, forecasting, and related decision support services.)</p> </p>",," <p><b>Coordinated Ocean Observations and Research Act of 2019</b></p> <p>This bill reauthorizes through FY2024 and revises the Integrated Coastal and Ocean Observation System (IOOS), which is a network of federal and regional entities that provide information about the nation's coasts, oceans, and Great Lakes, as well as new tools and forecasts to improve safety, enhance the economy, and protect the environment.</p> <p>The bill revises the authority of the National Oceanic and Atmospheric Administration (NOAA) to conduct scientific assessments related to storms, including to (1) direct NOAA to seek public input before the Named Storm Event Model (the official meteorological and oceanographic computerized model which utilizes data to replicate the magnitude, timing, and spatial variations of winds, rainfall, and storm surges associated with named storms for which post-storm assessments are conducted) takes effect, and (2) allow NOAA to deploy sensors to areas in coastal states that are at the highest risk of experiencing geophysical events that would cause indeterminate losses.</p> <p>The bill provides statutory authority for NOAA's National Water Center. (The center currently exists at NOAA as the research and operational center of excellence for hydrologic analyses, forecasting, and related decision support services.)</p> </p>",,,
